	time	title	summary	link	source
0	1488300617	sir philip green strikes pension deal with regulator	former owner sir philip green agrees a pound number cash settlement with the pensions regulator	http://www.bbc.co.uk/news/business-39118566	BBCNewsUK
1	1488304079	tunisia families to sue travel company	coroner rejects neglect finding against travel firm as he rules gunman unlawfully killed number britons	http://www.bbc.co.uk/news/uk-39109107	BBCNewsUK
2	1488327524	wild camping ban comes into force	new seasonal by laws come into force which will restrict camping around loch and in the	http://www.bbc.co.uk/news/uk-scotland-tayside-central-39117802	BBCNewsUK
3	1488304319	uk child migrant so hungry she ate grain meant for pigs	obrien was sent from england to australia and suffered sadistic abuse inquiry hears	http://www.bbc.co.uk/news/uk-39116293	BBCNewsUK
4	1488312308	woman who kept pound number note guilty of theft	bailey pocketed the cash after finding it on the floor of a local shop	http://www.bbc.co.uk/news/uk-england-stoke-staffordshire-39119990	BBCNewsUK
5	1488319930	manchester airport car tunnel fire closes runway	normal runway services have resumed after the blaze caused some flights to be delayed or diverted	http://www.bbc.co.uk/news/uk-england-manchester-39122961	BBCNewsUK
6	1488317636	st cathedral admits first woman to choir	st cathedral admits a woman to its professional choir for the first time in its history	http://www.bbc.co.uk/news/uk-england-london-39120557	BBCNewsUK
7	1488291606	south lakes safari zoo report shows hundreds of animal deaths	inspectors found a number of problems at south lakes safari zoo where a keeper was killed in number	http://www.bbc.co.uk/news/uk-england-cumbria-39116282	BBCNewsUK
8	1488326947	to open second tech campus in	the firm is opening a research and development centre at a former ministry of defence site	http://www.bbc.co.uk/news/uk-england-wiltshire-39117982	BBCNewsUK
9	1488311955	government gains injunction to block prison staff industrial action	the government wins a high court injunction blocking industrial action by prison staff	http://www.bbc.co.uk/news/uk-39121720	BBCNewsUK
10	1488328864	and vote transfers light up second ni election tv debate	botched energy scheme remains the hot topic in the second tv debate of the election campaign	http://www.bbc.co.uk/news/uk-northern-ireland-politics-39122150	BBCNewsUK
11	1488322666	car insurance chancellor vows action on compensation rates	philip promises urgent consultation on compensation rates after meeting car insurance bosses	http://www.bbc.co.uk/news/business-39122756	BBCNewsUK
12	1488284336	tunisia attack survivor reacts to coroners conclusion	olivia who was staying at the hotel in responds to the coroners conclusion	http://www.bbc.co.uk/news/uk-39112614	BBCNewsUK
13	1488293880	friends dig up oldest iron age gold in	the three necklaces and a bracelet found in a field are believed to be about number years old	http://www.bbc.co.uk/news/uk-england-stoke-staffordshire-39115392	BBCNewsUK
14	1488240802	devon mud hut woman allergic to modern life	she faces eviction from her mud hut home but says living in a modern house makes her ill	http://www.bbc.co.uk/news/uk-england-devon-38974005	BBCNewsUK
15	1488290585	a look inside new pound number super prison	the first prisoners will be moved to in on tuesday one of the biggest jails in europe	http://www.bbc.co.uk/news/uk-wales-39119243	BBCNewsUK
16	1488316323	art of the brick dc super heroes exhibit comes to london	this is what happens when a lawyer gives up his day job to follow his passion	http://www.bbc.co.uk/news/uk-england-london-39122368	BBCNewsUK
17	1488289472	the free range eggs that arent free range	heres a little explainer as to why were talking eggs today	http://www.bbc.co.uk/news/uk-39113477	BBCNewsUK
18	1488290382	model railway line planned for the highlands	model railway enthusiasts are being sought for an ambitious plan to lay a model railway track along the great glen	http://www.bbc.co.uk/news/uk-scotland-39116615	BBCNewsUK
19	1487324472	channel	coverage of latest developments	http://www.bbc.co.uk/news/10318089	BBCNewsUK
20	1488307062	philip green agrees to pay pound number into pension fund	retail tycoon says deal is part of a cash settlement with pension regulator which has now halted its enforcement action sir philip green has agreed to hand over pound number in cash to rescue the pension scheme and settle one of the biggest city rows of recent deal with the pensions regulator which is likely to help the billionaire keep his knighthood follows the controversial collapse of the department store chain last april which led to the loss of number jobs and left a pension deficit assessed at pound number continue reading	https://www.theguardian.com/business/2017/feb/28/philip-green-agrees-pay-363m-bhs-pension-fund	GuardianUK
21	1488326502	british people unaware of pollution levels in the air they breathe study	citizen science project launched as foe survey indicates population outside london overestimates air across the uk are underestimating the impact of the air pollution crisis in their local areas according to a new two thirds of respondents said they were concerned about the issue of air pollution but only one in number said they thought the air they breathe is bad continue reading	https://www.theguardian.com/environment/2017/mar/01/british-people-unaware-pollution-levels-air-breathe-friends-earth	GuardianUK
22	1488309648	tory pound number inheritance tax cut will worsen north south divide	research shows plans to increase threshold at which tax is paid will overwhelmingly benefit rich families in south east pound number conservative inheritance tax cut will exacerbate the north south divide an mp has warned as figures lay bare the winners and losers of a flagship government inheriting homes in constituencies in london and south east england will gain the lions share of the benefits from the tax cut according to research commissioned by the labour mp reeves continue reading	https://www.theguardian.com/money/2017/feb/28/tory-1bn-inheritance-tax-cut-will-worsen-north-south-divide	GuardianUK
23	1488326502	named worlds best sustainable seafood supermarket	marine stewardship council table has on top with number certified has been named the best sustainable seafood supermarket in the world in a survey published by the marine stewardship council the annual supermarket league table from the international certification body known for its blue rates british supermarkets on their sustainable seafood range more than number fisheries in over number countries are certified to the sustainable standard continue reading	https://www.theguardian.com/business/2017/mar/01/sainsburys-named-worlds-best-sustainable-seafood-supermarket	GuardianUK
24	1488326502	number of pupils failing to get first choice of school expected to rise	offer day could see number missing out as study also finds poorer children less likely to enter best performing secondaries hundreds of thousands of children and their parents will find out on wednesday whether they have got into the secondary school of their choice as figures reveal that an increasing number of parents in england are failing to get a place at their first choice the past number months more than half of towns and counties have seen a fall in the proportion of number year olds receiving a place in the first choice school according to a press association analysis of government data the problem is expected to be worse than last year due to an increase of number applicants continue reading	https://www.theguardian.com/education/2017/mar/01/pupils-first-choice-school-national-offer-day-england-secondaries-teachers	GuardianUK
25	1488309178	jack twitter case part of crusade against	defence lawyer says columnists tweets were part of social media circus in which was a willing sent by to jack monroe allegedly suggesting the food writer supported the defacing of war memorials were not defamatory because the mail online columnist was a professional controversialist merely engaging in robust political debate a court has is suing over the tweets sent in may number arguing that the messages were libellous led to abuse and death threats and caused serious harm to the reputation continue reading	https://www.theguardian.com/uk-news/2017/feb/28/jack-monroes-twitter-case-part-of-crusade-against-katie-hopkins	GuardianUK
26	1488320182	delays at manchester airport after van blazes in tunnel under runway	seven flights diverted to other airports and many scheduled departures and arrivals of the two runways at manchester airport was closed on tuesday evening after a van caught fire in a road tunnel under the landing were moved to the airports second runway to escape the smoke causing delays and diversions a manchester airport spokeswoman said seven flights had been diverted and there were delays for the majority of flights continue reading	https://www.theguardian.com/world/2017/feb/28/delays-at-manchester-airport-after-van-blaze-in-tunnel-under-runway	GuardianUK
27	1488313184	shrugs off brexit fears with massive uk expansion plan	technology group to open new number hectare campus as part of pound number investment and plans to double the technology company is to undergo a dramatic expansion in the uk by opening a new number hectare number acre campus as part of a pound number investment that will support its development of new battery technologies and company led by the billionaire inventor sir james will increase its uk geographical footprint tenfold by developing the campus on a former ministry of defence airfield and intends to at least double its workforce of number over the next few years continue reading	https://www.theguardian.com/technology/2017/feb/28/dyson-shrugs-off-brexit-fears-with-massive-uk-expansion-plan	GuardianUK
28	1488294256	come off it sunshine johnson hits back at john major	foreign secretary attacks prognostications of gloom and opponents of brexit who claim the sky is about to fall in johnson had said he is fed up with people droning and moaning about the risks of brexit saying that he felt like telling those raising concerns such as sir john major to come off it foreign secretary did not name the former prime minister but made clear in a speech to the british chambers of commerce that major was among those who had been warning that the sky was about to fall in continue reading	https://www.theguardian.com/politics/2017/feb/28/come-off-it-sunshine-boris-johnson-hits-back-at-john-major	GuardianUK
29	1488312534	reform of eu carbon trading scheme agreed	member states approve changes including euro number innovation fund to emissions plan for cleaner technology and pollution overhaul of the flagship trading scheme for cutting carbon emissions by european industries has been approved by the member agreement to reform the emissions trading system comes after almost two years of discussions but just two weeks after the european parliament voted in favour of a new directive continue reading	https://www.theguardian.com/environment/2017/feb/28/reform-of-eu-carbon-trading-scheme-agreed	GuardianUK
30	1488307892	poll shows number of european doctors are considering leaving uk	general medical council tells that survey found brexit was a factor for majority of doctors thinking of than half of the doctors from europe working in the uk are considering leaving the country because of brexit a survey by the general medical council indicates related thousands of doctors trained in europe may quit uk after brexit continue reading	https://www.theguardian.com/society/2017/feb/28/gmc-poll-suggests-half-of-european-doctors-are-considering-quitting-uk	GuardianUK
31	1488308895	sturgeon new vote on independence likely if scots get no eu deal	first minister says referendum rerun will be legitimate almost necessary unless special deal is made before article number sturgeon has said a second independence referendum will become a legitimate almost necessary step unless scotland secures a special relationship with the european union before article number is first minister used a speech in edinburgh to accuse mays government of putting the settlement that established the scottish parliament under grave threat by rejecting sturgeons calls for a special deal continue reading	https://www.theguardian.com/uk-news/2017/feb/28/second-independence-referendum-likely-if-scots-get-no-brexit-deal	GuardianUK
32	1488290385	families of tunisia beach attack victims to sue travel company	families can not rest or move on as coroner finds number britons were unlawfully killed but rejects argument neglected families of the british victims of a terror attack at a beach in tunisia have been left unable to rest or move on they said on tuesday as they vowed to sue the tour operator they hold responsible for their at the end of the seven week inquest into the number mass shooting at the imperial hotel in the relatives of number of the victims accused holidays owner tui of putting safety before a sale after the coroner ruled that their relatives were unlawfully killed but said he could not rule that neglect by the tour operator played a part continue reading	https://www.theguardian.com/world/2017/feb/28/tunisia-sousse-beach-attack-victims-were-unlawfully-killed-coroner-rules	GuardianUK
33	1488304989	calls for zoo to be shut after number animals die in four years	south lakes safari zoo whose licence is up for renewal had a death rate of number of its inhabitants between number and number have called for the owner of a zoo to face prosecution after the revelation that nearly number animals in its care had died in less than four years a damning report into conditions at south lakes safari zoo in which is home to more than number animals found that number inhabitants had died of causes including emaciation and hypothermia between december number and september number continue reading	https://www.theguardian.com/world/2017/feb/28/calls-for-cumbrian-zoo-to-be-shut-after-nearly-500-animals-die-in-four-years	GuardianUK
34	1488301590	corbyn partly to blame for copeland defeat says keir	shadow brexit secretary says labour has no prospect of winning next general election unless it changes leadership of the labour party was partly to blame for the loss of the copeland and the party has no prospect of winning the number general election unless it changes its approach the shadow brexit told journalists he was not convinced by the reasons given by some in the shadow cabinet for losing the copeland which included bad weather and recent media appearances by peter continue reading	https://www.theguardian.com/politics/2017/feb/28/corbyn-partly-to-blame-for-copeland-byelection-defeat-says-keir-starmer	GuardianUK
35	1488297888	woman who linked racism with scottish nationalism quits twitter over safety fears	claire a black scottish student who wrote article supporting sadiq khan believes critics were trying to discover where she black feminist researcher who was abused for criticising scottish nationalism has deleted her twitter account because she feared for her physical a scottish student at stirling university said she believed her often abusive opponents were trying to discover where she lived by searching and sharing tweets from her account continue reading	https://www.theguardian.com/uk-news/2017/feb/28/woman-who-linked-racism-with-scottish-nationalism-sadiq-khan-quits-twitter-over-safety-fears	GuardianUK
36	1488301822	authors angry after susan hill accuses bookshop of anti trump censorship	the novelist pulled out of an event at the book hive in because of its giveaway of books promoting resistance prompting consternation from her including harris patrick ness and sarah perry have leaped to the defence of a bookseller after susan hill launched an extraordinary attack on it for opposing us president donald an article in the spectator the woman in black writer said she had cancelled an event to promote her latest novel from the heart after discovering the shop would be giving away copies of novels by writers opposed to trumps politics including george nineteen eighty four and margaret the handmaids tale continue reading	https://www.theguardian.com/books/2017/feb/28/authors-angry-after-susan-hill-accuses-bookshop-of-anti-trump-censorship	GuardianUK
37	1488302559	rail staff at and northern to strike	calls for number hour walkout on number march with southern included after number of votes on train crew roles back over guards on trains are to start on northern and in march as the dispute that has wreaked havoc on southern services spreads to other parts of rail network strike ballots from union members working for and northern rail north showed more than number of votes backing strike action ahead of moves to change the roles of onboard train crew conductors on southern have been on strike repeatedly since last april continue reading	https://www.theguardian.com/uk-news/2017/feb/28/southern-merseyside-and-northern-rail-staff-to-strike-in-march	GuardianUK
38	1488304555	southern rail chief we arent doing anything wrong	networks boss blames strikes for problems faced by commuters as union calls for more walkouts in march the company running the southern rail network has defended its performance on the stricken route saying it is fulfilling its contract even as it announced a double digit slump in profits the boss of go ahead group which controls southerns operator railway said the company had acted in the interests of customers although passengers have suffered awful commutes continue reading	https://www.theguardian.com/business/2017/feb/28/southern-rail-go-ahead-strikes-rmt-union-march	GuardianUK
39	1488313003	sky bid could soon face uk investigation	culture secretary expected to refer takeover to after number century fox formally notifies eu competition number century fox is expected to formally notify the european competition regulator of its pound number takeover offer for sky later this week after which the uk culture secretary will have to decide whether to launch an investigation into the extent of control of uk the point the european commission makes bid notification public karen will have number working days to decide whether to issue a public interest intervention notice or continue reading	https://www.theguardian.com/business/2017/feb/28/murdoch-sky-bid-uk-takeover-ofcom-21st-century-fox-eu	GuardianUK
40	1488326790	top state schools are preserve of the rich social mobility charity warns	over number of top performing state schools take in fewer disadvantaged pupils than they should for their catchment area with faith schools called out for being the most socially selective	http://www.independent.co.uk/news/education/education-news/top-state-schools-preserve-rich-sutton-trust-education-charity-gcse-school-places-national-offer-day-a7604176.html	IndependentUK
41	1488323940	cancer surgeon accused of after carrying out completely unnecessary breast operations to earn extra money	his alleged victims include a number year old woman who was left devastated when told unnecessary operations had profoundly affected her ability to	http://www.independent.co.uk/news/uk/crime/surgeon-breast-cancer-ian-paterson-completely-unnecessary-operation-nottingham-crown-court-a7604766.html	IndependentUK
42	1488319200	housing crisis will continue under current government policies top civil servant in charge of housing says	is the permanent secretary at the department for communities and local government	http://www.independent.co.uk/news/uk/politics/housing-white-paper-shortage-crisis-homes-dclg-communities-melanie-dawes-a7602616.html	IndependentUK
43	1488317760	only mp douglas holds secret talks on defecting to tories amid ongoing row with nigel farage	major ukip donor banks has threatened to stand against mr in the number general election	http://www.independent.co.uk/news/uk/politics/douglas-carswell-ukip-mp-nigel-farage-step-down-knighthood-peerage-a7604736.html	IndependentUK
44	1488317116	leaked appear to show mays close adviser linked to election campaign being investigated by police	the conservatives have previously said mr timothy was assisting the national campaign	http://www.independent.co.uk/news/uk/politics/nick-timothy-theresa-may-thanet-investigation-craig-mackinlay-s-a7604651.html	IndependentUK
45	1488314640	manchester airport fire in tunnel closes runway	some delays expected	http://www.independent.co.uk/news/uk/home-news/manchester-airport-fire-runway-closed-tunnel-car-delays-flights-service-latest-a7604706.html	IndependentUK
46	1488313260	keir confirms labour will vote for move to get parliament final say on mays brexit deal	sir keir said labour will pick up the baton if lords approve the change	http://www.independent.co.uk/news/uk/politics/brexit-latest-keir-starmer-theresa-may-article-50-house-of-lords-commons-meaningful-vote-a7604681.html	IndependentUK
47	1488311040	brexit uk economy sleepwalking into a disaster without regional immigration policy	different regions must have powers to determine their own skills needs after the uk leaves the eu experts tell the lords	http://www.independent.co.uk/news/business/news/uk-economy-sleepwalking-into-a-disaster-unless-we-adopt-a-regional-immigration-policy-a7604631.html	IndependentUK
48	1488307620	may set for defeat in the house of lords over eu citizens rights	the government is accused of using eu citizens as bargaining chips	http://www.independent.co.uk/news/uk/politics/brexit-latest-eu-citizens-rights-theresa-may-amber-rudd-house-of-lords-a7604566.html	IndependentUK
49	1488302515	labour has no prospect of winning the next election says senior shadow cabinet minister	sir keir is shadow brexit secretary	http://www.independent.co.uk/news/uk/politics/keir-starmer-jeremy-corbyn-leadership-election-challenge-soft-coup-brexit-a7604351.html	IndependentUK
50	1488301860	brexit will make fighting terrorism harder warns eu security commissioner	its likely that there will be some practical limits on what can be achieved compared with today an inquiry by a committee of is told	http://www.independent.co.uk/news/uk/politics/brexit-terrorism-warning-uk-theresa-may-eu-security-commissioner-a7604376.html	IndependentUK
51	1488301444	mays national security adviser sir mark grant resigns after reports	senior official is said to have annoyed prime minister by talking over her in meeting	http://www.independent.co.uk/news/uk/politics/heresa-may-national-security-adviser-resigns-mansplaining-reports-downing-street-fed-up-a7604036.html	IndependentUK
52	1488301119	fines for using mobile phone while driving to double	government hikes penalty points toll to six	http://www.independent.co.uk/news/uk/home-news/mobile-phone-driving-fines-law-explained-penalty-to-double-march-new-law-a7603691.html	IndependentUK
53	1488300840	faces jack monroe lawsuit after allegedly accusing of supporting memorial vandalism	hearing originates from a series of tweets exchanged between the pair after a london war memorial was with the words fuck tory scum during an anti austerity demonstration	http://www.independent.co.uk/news/uk/home-news/katie-hopkins-jack-monroe-lawsuit-second-world-war-a7604296.html	IndependentUK
54	1488300600	most european doctors considering leaving uk due to brexit reveals	exclusive general medical council warns that the departure of so many trained doctors would have a serious impact on patient care	http://www.independent.co.uk/news/uk/politics/european-brexit-doctors-uk-gmc-survey-nhs-hospitals-leaving-considering-eu-latest-a7604121.html	IndependentUK
55	1488299880	tunisia faces prospect of vicious cycle as tourism slumps and extremism rises	since the horrific events of june number there has been just one significant terror attack in tunisia against presidential guards there were none in number yet british tourist visits to the country have dropped number per cent and stayed down	http://www.independent.co.uk/news/world/africa/tunisia-inquest-analysis-sousse-vicious-cycle-extremism-tourism-a7604251.html	IndependentUK
56	1488298657	jewish museum in london evacuated over bomb threat	children from two different schools were some of the number people hurried out of building	http://www.independent.co.uk/news/uk/home-news/jewish-museum-london-evacuated-bomb-threat-camden-met-police-emergency-services-a7604111.html	IndependentUK
57	1488297673	oxford university squatters who turned college building into homeless shelter have been evicted	twenty people have been sleeping at the shelter which has its own kitchen and showering facilities since new years eve	http://www.independent.co.uk/news/uk/home-news/oxford-university-squatters-homeless-shelter-evicted-wadham-college-iffley-open-house-a7604081.html	IndependentUK
58	1488295548	cornwall wanted guarantees it wouldnt lose pound number eu funding after brexit but the government turned it down	the current process forces cornwall to compete for investment with more affluent places such as london birmingham bristol and the south east	http://www.independent.co.uk/news/uk/politics/cornwall-lose-eu-funding-uk-government-replace-brexit-latest-dclg-request-down-julian-german-a7603921.html	IndependentUK
59	1488293460	dont let become a dirty word johnson says	foreign secretary warns against hauling up the drawbridge to free trade	http://www.independent.co.uk/news/uk/politics/boris-johnson-globalisation-brexit-george-osborne-british-chambers-of-commerce-bcc-a7603926.html	IndependentUK
60	1488285540	tunisia terror families to sue travel firm	the family of a briton killed in the tunisian beach attack have said they feel robbed of a future	http://news.sky.com/story/tunisia-beach-attack-victims-family-want-justice-10785094	SkyNewsUK
