	time	title	summary	link	source
61	1488276960	tunisia attack who were british victims	gunman killed number britons when he opened fire at a beach resort in tunisia in june number	http://news.sky.com/story/tunisia-beach-attack-who-were-the-british-victims-killed-in-sousse-10784959	SkyNewsUK
62	1488292440	green pays pound number towards pension scheme	sir philip green has paid pound number to settle the pension schemes of collapsed retailer eight months after he pledged to sort the issue	http://news.sky.com/story/philip-green-pays-163363m-towards-bhs-pension-scheme-10785232	SkyNewsUK
63	1488296040	general warns brit is fighters well kill you	a senior british military officer has warned britons fighting for islamic state that we will find you and kill you	http://news.sky.com/story/general-warns-british-islamic-state-fighters-we-will-find-and-kill-you-10785289	SkyNewsUK
64	1488279360	man jailed for life over matalan double murder	a man who murdered his ex girlfriend and her new partner outside the shop where they worked has been jailed for life	http://news.sky.com/story/man-jailed-for-life-over-double-murder-outside-matalan-store-in-cardiff-10784992	SkyNewsUK
65	1488318420	poorer pupils priced out of top secondaries	top rated schools in england are pushing up house prices in local catchment areas making them more socially selective according to a new report	http://news.sky.com/story/poorer-pupils-are-being-priced-out-of-top-secondaries-report-says-10785778	SkyNewsUK
66	1488316920	wednesdays national newspaper front pages	whats in the papers	http://news.sky.com/story/wednesdays-national-newspaper-front-pages-10785719	SkyNewsUK
67	1488300180	footballer cleared of sex with number year old girl	former league one footballer jack has been cleared of sexually taking advantage of a number year old girl	http://news.sky.com/story/former-league-one-footballer-cleared-of-sex-with-14-year-old-girl-10785420	SkyNewsUK
68	1488317580	unwell team sky doctor out of doping inquiry	former team sky doctor richard freeman has pulled out of a long awaited appearance before a parliamentary inquiry into doping in sport	http://news.sky.com/story/ex-team-sky-doctor-too-ill-to-appear-before-mps-doping-inquiry-10785736	SkyNewsUK
69	1488312840	treasury concession over car insurance bill rise	outrage within the insurance industry over a looming increase in personal injury has resulted in the promise of a government consultation and new law if needed	http://news.sky.com/story/treasury-concession-on-insurance-bill-rise-amid-industry-outrage-10785686	SkyNewsUK
70	1488304915	may wants brexit deal that allow to flourish	london prime minister may has been clear that her government wants to secure a brexit deal with the european union that will allow and other to flourish in britain her spokesman said on tuesday	http://feeds.reuters.com/~r/reuters/UKDomesticNews/~3/qsVHH0N3gCw/uk-britain-eu-nissan-may-idUKKBN1671Z4	ReutersUK
71	1488306758	scottish leader says hard brexit stance raises chance of new independence vote	london the sheer intransigence of the british government over brexit could lead to a second scottish independence referendum the head of the devolved scottish government said on tuesday	http://feeds.reuters.com/~r/reuters/UKDomesticNews/~3/-t8lE4O9qDY/uk-britain-eu-scotland-idUKKBN1670N7	ReutersUK
72	1488274809	uk consumer morale dips as inflation pinches households	london british consumer morale edged lower in february as rising inflation following last years brexit vote made householders warier about the outlook for their finances surveys showed	http://feeds.reuters.com/~r/reuters/UKDomesticNews/~3/U2nKknqh1ek/uk-britain-economy-consumersentiment-idUKKBN16628C	ReutersUK
73	1488312611	ex barclays traders put money before honesty uk court hears	two former barclays traders showed scant regard for honesty and integrity when they conspired to rig global interest rates a lawyer for the uk serious fraud office told a london jury trial on tuesday	http://feeds.reuters.com/~r/reuters/UKDomesticNews/~3/IFZpH6SiyWE/uk-britain-libor-court-idUKKBN1671T4	ReutersUK
74	1488287002	says thousands of london drivers threatened by english language test	london tens of thousands of london private hire drivers could lose their licences due to new english reading and writing requirements taxi app said on tuesday at the start of a court battle to halt the plans	http://feeds.reuters.com/~r/reuters/UKDomesticNews/~3/OOEv7dXoAoY/uk-uber-britain-idUKKBN1671GR	ReutersUK
75	1488280435	london politicians tell uk government not to use eu workers as bargaining chip	london european union workers are the lifeblood of london with sectors such as health and construction reliant on their labour and so they should be guaranteed the right to stay after brexit politicians from the british capital said on tuesday	http://feeds.reuters.com/~r/reuters/UKDomesticNews/~3/MYmrVElo2l8/uk-britain-eu-migrants-idUKKBN16703S	ReutersUK
76	1488279497	insurance to meet uk finance minister over discount rate cut trade body	london chief executives of number of biggest motor and commercial liability insurers will meet finance minister philip on tuesday to ask him to stop this weeks crazy discount rate decision an industry trade body said	http://feeds.reuters.com/~r/reuters/UKDomesticNews/~3/rZU_rSxwokI/uk-insurance-discountrate-idUKKBN16716O	ReutersUK
77	1488288890	bank of hogg gets rough ride from lawmakers	london the bank of newest deputy governor came under criticism from lawmakers on tuesday for sticking too closely to the central banks orthodoxy and faced tough questions about her links to the banking industry	http://feeds.reuters.com/~r/reuters/UKDomesticNews/~3/sNFr5V3UEwc/uk-britain-boe-hogg-idUKKBN16712C	ReutersUK
78	1488291475	in blow to uk back stricter anti tax dodging law on trusts	brussels eu lawmakers voted on tuesday to let the public see data about the owners of trusts and companies tightening draft anti money laundering legislation that would have given such access to tax authorities but not to journalists and activists	http://feeds.reuters.com/~r/reuters/UKDomesticNews/~3/z0IqJc-R4Lk/uk-britain-eu-tax-trusts-idUKKBN1671OR	ReutersUK
79	1488302212	austerity measure pm may gives up crisps for lent	london british prime minister may who is not known for her self indulgence has revealed she will be giving up crisps in the run up to easter a period called lent when many christians fast or give up luxuries	http://feeds.reuters.com/~r/reuters/UKDomesticNews/~3/rF8p_RhG7CE/uk-britain-politics-lent-idUKKBN16724J	ReutersUK
80	1488302637	number animals die at british zoo that left a monkey to rot behind a radiator	south lakes safari zoo in north west england has been found responsible for the deaths of number animals in its care some of which perished from avoidable causes including emaciation and hypothermia read full article at	https://www.rt.com/uk/378934-animals-die-zoo-england/?utm_source=rss&utm_medium=rss&utm_campaign=RSS	RTUK
81	1488299360	student turns dead animals into pencil cases pictures	a butcher turned design student is making a killing by transforming dead animals into stationery and selling them online read full article at	https://www.rt.com/uk/378926-animal-taxidermy-pencil-case/?utm_source=rss&utm_medium=rss&utm_campaign=RSS	RTUK
82	1488298555	surveillance state council staff across uk monitoring public with body cameras	officials in the majority of councils across britain are playing the role of big brother and wearing body cameras to record and prevent minor offences such as littering or bad parking read full article at	https://www.rt.com/uk/378923-surveillance-body-cameras-councils/?utm_source=rss&utm_medium=rss&utm_campaign=RSS	RTUK
83	1488296737	families of tunisia terrorism victims devastated after tour operator cleared of neglect	the coroner at the inquest into the deaths of number british tourists at the hands of an islamic extremist in tunisia in number has cleared holiday firm tui of neglect read full article at	https://www.rt.com/uk/378917-terrorism-beach-tunisia-inquiry/?utm_source=rss&utm_medium=rss&utm_campaign=RSS	RTUK
84	1488296611	next generation uk warships have missile launchers but no missiles	advanced pound number billion number billion type number warships are equipped with missile launchers but lack the missiles for them it is claimed read full article at	https://www.rt.com/uk/378916-battleships-missiles-military-budget/?utm_source=rss&utm_medium=rss&utm_campaign=RSS	RTUK
85	1488291857	johnson hits out at brexit moaning droning after blair major doom mongering	uk foreign secretary johnson has hit out at those projecting brexit doom and gloom in a speech seen as a rebuke of former prime minister sir john major read full article at	https://www.rt.com/uk/378905-boris-brexit-major-blair/?utm_source=rss&utm_medium=rss&utm_campaign=RSS	RTUK
86	1488291377	more govt cuts ordered despite uk public services being at tipping point	government departments have been ordered to find extra spending cuts from their day to day budget in order to save pound number by number read full article at	https://www.rt.com/uk/378904-hammond-nhs-austerity-mcdonnell/?utm_source=rss&utm_medium=rss&utm_campaign=RSS	RTUK
87	1488291310	pro palestinian students cry censorship over israel apartheid week	pro palestinian student activists claim freedom of speech at universities is under threat after they were banned from championing palestinian human rights on campus read full article at	https://www.rt.com/uk/378903-palestine-censorship-university-israel/?utm_source=rss&utm_medium=rss&utm_campaign=RSS	RTUK
88	1488284965	not all should be jailed police chief	who view indecent images but do not molest children should not be jailed a leading child protection police officer has said read full article at	https://www.rt.com/uk/378882-pedophile-jail-police-bailey/?utm_source=rss&utm_medium=rss&utm_campaign=RSS	RTUK
89	1488283370	royal air force women banned from wearing skirts on parade to attract recruits	female members of the royal air force have been banned from wearing skirts on parade in order to make the service more inclusive for recruits read full article at	https://www.rt.com/uk/378879-military-women-skirts-transgender/?utm_source=rss&utm_medium=rss&utm_campaign=RSS	RTUK
90	1488280080	nigel farage wants only mp kicked out of party for sabotaging his knighthood	ex ukip leader nigel farage has called for the only mp to be sacked over claims he is trying to divide the kippers in every imaginable way read full article at	https://www.rt.com/uk/378874-farage-ukip-carswell-banks/?utm_source=rss&utm_medium=rss&utm_campaign=RSS	RTUK
91	1488279246	unmanned warfare is coming says uk defense secretary	unmanned warfare across land sea and air will soon be the norm and the uk is intensively researching cutting edge drone technology defense secretary michael said at an event at the university of oxfords department of engineering science read full article at	https://www.rt.com/uk/378872-drone-warfare-oxford-fallon/?utm_source=rss&utm_medium=rss&utm_campaign=RSS	RTUK
92	1488278876	national security adviser forced out for to pm may	mays main national security aide sir mark grant was allegedly pushed into retirement after his habit of talking over the prime minister during meetings became too much for her to take read full article at	https://www.rt.com/uk/378871-mansplaining-national-security-may/?utm_source=rss&utm_medium=rss&utm_campaign=RSS	RTUK
93	1488275324	mass drunken brawl on british train sparked by bagel video	police were called to break up a fight on a train after rowdy passengers kept placing bagels on other travelers heads read full article at	https://www.rt.com/uk/378856-bagel-train-brawl-drunk/?utm_source=rss&utm_medium=rss&utm_campaign=RSS	RTUK
94	1488217500	in fear for their life government spending thousands to protect worried judges	tens of thousands of pounds are being spent by the ministry of justice to step up security measures for judges worried about their safety read full article at	https://www.rt.com/uk/378792-thousands-judges-safety-justice/?utm_source=rss&utm_medium=rss&utm_campaign=RSS	RTUK
95	1488216060	cash strapped royal navy cancels annual air show to focus on counter terror ops	royal navy is so strapped for cash that it has been forced to cancel its annual air show so that its helicopters can be used to protect the nations shipping fleet read full article at	https://www.rt.com/uk/378791-royal-navy-show-cancelled/?utm_source=rss&utm_medium=rss&utm_campaign=RSS	RTUK
96	1488210780	tory government cutting school funding for first time in decades ifs report	the uk government will cut school funding for the first time in two decades a new analysis by the institute for fiscal studies ifs claims read full article at	https://www.rt.com/uk/378783-government-school-funding-education/?utm_source=rss&utm_medium=rss&utm_campaign=RSS	RTUK
97	1488210660	jailing parents for female genital mutilation unlikely to benefit the child police	an english police force has come under fire for claiming the prosecution of parents who allow female genital mutilation of their children is unlikely to benefit the child read full article at	https://www.rt.com/uk/378782-fgm-police-prosecution-child/?utm_source=rss&utm_medium=rss&utm_campaign=RSS	RTUK
98	1488206520	soft coup against jeremy corbyn is already underway shadow chancellor	shadow chancellor john claimed this week that members of his own party are in cahoots with the media in a renewed attempt at bringing down the labour leader read full article at	https://www.rt.com/uk/378766-soft-coup-labour-corbyn/?utm_source=rss&utm_medium=rss&utm_campaign=RSS	RTUK
99	1488204600	is mays brexit strategy about to be derailed by number scottish	uk prime minister may fears first minister nicola sturgeon could call for a second scottish independence referendum the moment negotiations for exit from the eu are launched next month read full article at	https://www.rt.com/uk/378758-theresa-may-scotland-independence/?utm_source=rss&utm_medium=rss&utm_campaign=RSS	RTUK
100	1488271020	la la land handed best picture oscar in error instead of moonlight	moonlight has been awarded the best picture oscar after la la land was handed the top gong in error the awards ceremony was plunged into chaos after warren was given the wrong envelope and appeared to hesitate when he saw the card before co presenter announced la la land as the winner producer jordan came forward to inform the cast that moonlight had indeed won showing the envelope as proof after the la la land crew had already given its acceptance speech	https://uk.news.yahoo.com/la-la-land-handed-best-picture-oscar-error-051700519.html	YahooUK
101	1488301527	ukip in open civil war as nigel farage calls for douglas to be thrown out after knighthood row	ukip was in a state of open civil war on monday night after nigel farage publicly warned that the party will collapse unless its douglas is thrown out mr former uk independence party leader had sought to split and divide every way imaginable since defecting from the conservatives to ukip in number the two men have been at odds for years over the policies but their antipathy came to a claims that mr frustrated mr chances of being awarded a knighthood	https://uk.news.yahoo.com/ukip-open-civil-war-nigel-213000720.html	YahooUK
102	1488266400	crazy compensation bill hike to hit nhs and insurers	insurers have condemned a crazy reform increasing for personal injury victims that they say will lead to steeply higher premiums for motorists as well as landing the nhs with a pound number bill the association of british insurers said the change announced by the ministry of justice was reckless in the extreme and affect number million motor insurance policies between pound number and pound number will be added to the average car insurance policy according to accountants with hikes of up to pound number for younger drivers aged number to number and pound number for motorists aged over number	https://uk.news.yahoo.com/crazy-compensation-bill-hike-hit-085700667.html	YahooUK
103	1488320180	when does lent number start and what is ash wednesday	when is ash wednesday number ash wednesday which marks the start of lent in the christian calendar has been observed by britons for centuries its exact date changes every year because it is determined by when easter falls	https://uk.news.yahoo.com/ash-wednesday-2017-lent-observed-112555337.html	YahooUK
104	1488320242	pancake day number the best sweet and savoury recipes and everything else you need to know	find out all you need to know about pancake day number from pancake the possibly pagan origins of shrove tuesday tradition of pancake tossing when is pancake day number pancake day has been celebrated by britons for centuries known also as shrove tuesday its exact date rather confusingly changes every year because it is determined by when easter falls	https://uk.news.yahoo.com/pancake-day-2017-best-sweet-153829279.html	YahooUK
105	1488285007	drugs twist and sex tape shocker number new pics		https://uk.news.yahoo.com/emmerdale-drugs-twist-sex-tape-123007388.html	YahooUK
106	1488317340	sir philip green pays pound number towards pension scheme	sir philip green has paid pound number to settle the pension schemes of collapsed retailer eight months after he pledged to sort the issue i have today made a voluntary contribution of up to pound number to enable the trustees of the pension schemes to achieve a significantly better outcome than the schemes entering the pension protection fund which was the goal from the outset he said in a statement the billionaire said the settlement meant that all legal matters and claims from the pensions regulator had now been withdrawn	https://uk.news.yahoo.com/philip-green-pays-363m-towards-bhs-pension-scheme-143900018.html	YahooUK
107	1488281520	british songwriter accuses number of stealing song for baby	a british songwriter is claiming rock band number stole one of his songs for their number album baby paul rose has filed a lawsuit in manhattan saying number and lead singer bono lifted elements of his song nae for their song the fly the lawsuit says number heard his song after signing up with island records in number the same year rose provided a demo tape to recording studio executives	https://uk.news.yahoo.com/british-songwriter-accuses-u2-stealing-song-achtung-baby-113200592.html	YahooUK
108	1488245820	car involved in shooting goes on sale for pound number	a memorabilia dealer is selling the car which rapper was travelling in when he was shot and killed in a drive by attack nearly number years ago the number which once belonged to death row records co founder knight has been listed with an asking price of number pound number in california several photographs of the have been uploaded by moments in time but the company has not provided any details of the cars history since death in september number	https://uk.news.yahoo.com/car-involved-tupac-shakur-shooting-goes-sale-1-013700015.html	YahooUK
109	1488267754	five sentenced to death for killing of japanese citizen in bangladesh	a bangladesh court handed down the death sentence on tuesday for five militants found guilty of killing a japanese citizen court officials said number was gunned down in october number by masked men on a motorcycle on his way to visit a grass farm project in the northern district of rangpur the killing came less than a week after an italian aid worker had been killed in a similar fashion in diplomatic quarter	https://uk.news.yahoo.com/five-sentenced-death-killing-japanese-citizen-bangladesh-074234588.html	YahooUK
110	1488268711	says will grow ahead of market after profit rises number percent	british engineering group reported a number percent rise in adjusted pretax profit on tuesday just beating market expectations and said it would grow ahead of both its main aerospace and autos markets in number the company which supplies components for airbus and boeing aircraft and car makers including volkswagen reported adjusted pretax profit of number million pounds number million on sales up number percent to number billion pounds comfortably ahead of forecasts it said it expected organic sales in its aerospace division to rise slightly above the number percent market growth forecast by independent analysts	https://uk.news.yahoo.com/gkn-says-grow-ahead-market-profit-rises-12-072539766--finance.html	YahooUK
111	1488268853	eastern japan shaken by number magnitude quake no tsunami warning	a number magnitude earthquake shook a wide swathe of eastern and northeastern japan on tuesday including the capital tokyo where buildings swayed but no tsunami warning was issued and there were no immediate reports of damage or injuries the tremor came less than two weeks before the sixth anniversary of a march number number number magnitude earthquake that set off a massive tsunami and meltdowns at the nuclear plant earthquakes are common in japan one of the worlds most seismically active areas	https://uk.news.yahoo.com/eastern-japan-shaken-5-6-magnitude-quake-no-080053795.html	YahooUK
112	1488271767	british girl number battling for her life after being sucked into hot tub filter at hotel	a four year old british girl is fighting for her life in hospital after she was sucked into a hot tub filter at a hotel isabella was in a with her mother nicola number at a resort in bulgaria when her bottom became stuck isabella is now in intensive care in hospital in the black sea resort of varna	https://uk.news.yahoo.com/british-girl-4-battling-for-her-life-after-being-sucked-into-hot-tub-filter-at-hotel-084927380.html	YahooUK
113	1488268121	thai palace sacks top official for being extremely evil	the thai palace has fired an adviser for being extremely evil signalling that more action could take place over the coming days police general was the second aide to king maha to be removed from duty in recent weeks had served as an intelligence chief under former prime minister and had been one of the top figures frequently seen at the palace	https://uk.news.yahoo.com/thai-palace-sacks-top-official-074841186.html	YahooUK
114	1488285000	coronation street spoiler violence on the street	we take a look at whats coming up on coronation street this wednesday	https://uk.news.yahoo.com/coronation-street-spoiler-violence-street-123000443.html	YahooUK
115	1488269635	women in the no longer allowed to wear skirts on parade	women can serve in all roles across other than as regiment officers or regiment gunners in number named one of the top number employers for women who make up around number per cent of its personnel more than the proportion in the army or royal navy a spokesman for uniform regulations including dress for formal parades are regularly reviewed	https://uk.news.yahoo.com/women-raf-no-longer-allowed-010749661.html	YahooUK
116	1488262967	kim nam assassination south korea believes number north spies behind murder	south intelligence agency said on monday number february that it believed four spies of the north were behind the assassination of kim nam on number february the other two were associated with air the norths state run airline company and economics and trading general corporation nis added	https://uk.news.yahoo.com/kim-jong-nam-assassination-south-062247667.html	YahooUK
117	1488266460	image of david haye knocking out tony projected in liverpool as endless recreates iconic muhammad scene	david hayes team projected an image of him knocking out tony on the side of a hotel in liverpool as their fight build up intensified on the number year old has once again teamed up with artist endless ahead of this weekends bout with at the number arena who has reproduced the iconic image of muhammad versus sonny with haye knocking to the canvas the hotel on which the image was projected was the venue for monday evenings pre fight press conference where haye said would be risking his life by entering the ring with him	https://uk.news.yahoo.com/image-david-haye-knocking-tony-072100345.html	YahooUK
118	1488269049	killer theatre review grubby production without peaceable intent	this collection of monologues relentlessly dispiriting and without a glimmer of relief or redemption is the latest work from philip ridley a playwright whose love of violent shock is wearing very thin for this critic ridleys world view is one of unremitting bleakness with civil society perpetually on the brink of crumbling to random extreme and uncontained violence in the midst of this desolation what does work is director use of the unsettling intimacy and immediacy of binaural sound	https://uk.news.yahoo.com/killer-theatre-review-grubby-production-080409442.html	YahooUK
119	1488267680	number things in tech you need to know today	number senior vice president of engineering amit was reportedly asked to leave the company after it emerged he had been accused of harassment at his prior job at travis asked to resign as the company conducts a separate investigation into allegations of harassment by former employee susan fowler number has pledged to send a manned mission to the moon in number musk said two private unnamed passengers have paid to take part in the flight which he said could be a significant revenue driver for the company number heir apparent jay y lee is to be charged in south korea on charges of bribery embezzlement and hiding assets overseas lee was arrested earlier this month over claims had paid to secure government support for a company merger	https://uk.news.yahoo.com/10-things-tech-know-today-074120780.html	YahooUK
