	time	title	summary	link	source
120	1488320118	the replacement episode number review number questions were already asking of maternity leave drama	the replacement tapped into every working mum to bes nightmare what happens when your maternity cover appears to be taking your job your friends your life from under your nose christie and were well matched in this slick urban thriller set in beautifully lit glasgow full of pregnant coughs pauses remarks that could be taken two ways and brooding looks as ellen was first enthralled then disturbed then thoroughly suspicious of her maternity replacement the skill in the writing meant that we became increasingly suspicious not just of but also ellen especially after we learnt her husband had previously been her psychiatrist the real antagonist here and other questions number every sympathetic gesture and inquiry by into wellbeing even her phone call to husband made her seem too sympathetic to be true was she genuinely concerned or was it all a ploy to undermine self esteem number that whole pitch to the client that ended up doing instead of ellen never mind her motive why were they making a grandiose pitch for a library that they were already building number why did invite everyone to sunday lunch and then somehow they all ended up at kay and strange to arrange a gathering at someone elses house number what is behind the aggro in family life visibly seething with her husband shouting at her daughter and the silent separated lives number did bosses really want her to start her maternity early out of concern for her or because they wanted to take her place number the decision got taken out of their hands with ellen sneaking onto the work site falling over and being suspended after reported it again was this out of concern or self interest number why did husband tell ellen about his wifes efforts to meet the client take photos of the library etc we know things arent all right between them did he accidentally drop his wife in it with ellen or was that a deliberate bit of stirring number what was kays problem before her fatal visit to the library the obvious answer being an affair between and the too good to be true david or something a bit more unexpected the replacement continues next week on one catch up on type type read more number function e undefined track e function if player if object commercial video a o commercial and category if a video package c sponsorship number commercial video package a c i player else t function t number number this feed and its contents are the property of the post uk and use is subject to our terms it may be used for personal consumption but may not be distributed on a	http://www.huffingtonpost.co.uk/2017/02/28/the-replacement-episode-1-review_n_15069964.html?utm_hp_ref=uk&ir=UK	HuffPostUK
121	1488310747	michael crick chases mays chief adviser down whitehall over south expenses	top adviser nick timothy challenged by over his role in investigation full report number number channel number number february number number prime minister mays top adviser has been by channel number michael crick as the controversy over the conservatives general election expenses mounts the programme has led a long running investigation into the tory campaign to win the kent seat of south where they were fighting to stop ukip leader nigel farage winning a commons seat in last years election its latest report centres on the prime ministers chief of staff nick timothy who appears to have played a key role in the campaign and raises further questions over whether the tories failed to properly declared tens of thousands of pounds of hotel bills in the clip confronts timothy over a cache of documents the programme obtained revealing the adviser devised the strategy and campaigning messages that were used by the winning tory candidate craig channel number says the contradict a previous statement issued by the conservative party which said timothy provided assistance for the conservative national team i challenge top adviser nick timothy as secret show his role in s number michael crick february number number over two minutes timothy maintains a steadfast silence as crick fires a series of questions at him as he makes his way from westminster tube station to downing street his only reaction is to remove an villa scarf crick labels timothy the brains behind the the campaign and questions why he appeared to be pitching advice when he was still working as mays adviser in the home office the reporter says suggestions he made to a campaign leaflet were showing he had a big influence on the push the questions surround around whether expenses incurred at the royal harbour hotel should have been declared as local expenses by or his agent under election law expenses for the promotion of a candidate in a constituency must be declared locally and are subjected to tight limits the south seat is one of number currently under police investigation the electoral commission is also investigating the party maintains that it acted entirely within the law type type related number this feed and its contents are the property of the post uk and use is subject to our terms it may be used for personal consumption but may not be distributed on a	http://www.huffingtonpost.co.uk/2017/02/28/michael-crick-theresa-may-nick-timothy-south-thanet-expenses_n_15066252.html?utm_hp_ref=uk&ir=UK	HuffPostUK
122	1488302531	john urged workers to break strike laws as he backed insurrection against the tories	function e undefined track e function if player if object commercial video a o commercial and category if a video package c sponsorship number commercial video package a c i player else t function t number number jeremy key ally john urged workers to defy strike laws backed occupation of city buildings and supported insurrection that gets in the face of business chiefs at a series of meetings between number and number who is now labours shadow chancellor advocated radical street action to take advantage of the classical marxist crisis of capitalism in britain and the us video footage of the meetings which has been passed to uk show him urging campaigners to mobilise to bring down the tory liberal democrat coalition through a combination of sit ins squats protests and strikes at the meetings which were supported by an array of far left groups such as the socialist workers party urged workers to defy anti trade union laws and mobilise whatever the law says described tory ministers as social criminals and vowed we will try you for what you have done in implementing cuts called for labour to automatically support every occupation by protestors including the takeover of building owned by merchant bank said and others had a duty to turn up to every mass action on the streets said the ballot box will not become available to labour without street action first called on the to back british sympathy strikes to support industrial action in france and spain rallied campaigners against city bosses to get really into them in their faces joked that he wanted to kettle the police and make citizens arrests on them veteran campaigner made his views known at the rallies in the last parliament when he was a backbencher and ed miliband was leader of the labour party at a unite the resistance emergency meeting in january number he urged local trade unionists to defy their leaderships by staging unofficial strikes in their area if we cant win the national union for industrial action we are going to have to talk to see whether or not we take branch industrial action at the local level and that does mean having that discussion about how we defy the anti trade union laws he said praised unite and builders union workers for coming together in unofficial action saying they couldnt give a toss about industrial relations rules theyre actually closing down site after site at a defend the right to protest meeting in march number he urged protestors whatever you do though youve got to recognise you have a responsibility to they will break us when individual disputes have happened whatever the law says if you mobilise en masse we win every time theres an action no matter who calls it whatever the action is we have a responsibility on us a duty on us to turn up and be part of that mass action thats it isnt it theres no other lesson to be learned from this referring to the police union the police federation which staged marches against pension cuts joked that they should now be subjected to the same tactics they used on protestors the police federation are now starting their campaign and im urging them to have a demonstration he said and we should offer to steward that and when we get near parliament square what i want you to do is kettle them in id like you to do is undertake a large number of citizens arrests function e undefined track e function if player if object commercial video a o commercial and category if a video package c sponsorship number commercial video package a c i player else t function t number number at a unite the resistance conference in november number the mp for hayes and called for tory and ministers to be constantly tracked by protestors i want to be in a situation where no tory mp no coalition minister can travel anywhere in the country or show their face anywhere in public without being challenged he also warned that one day tory ministers would be tried for their crimes against the poorest in the uk my view is theyre social criminals and eventually i warn them we will try you for what youve done at the same meeting suggested british workers should take action in support of those taking industrial action in the rest of europe when others were on strike in france and spain and other countries the response was to send out a press release that was it we became the scabs of europe function e undefined track e function if player if object commercial video a o commercial and category if a video package c sponsorship number commercial video package a c i player else t function t number number and at a unite the resistance meeting in june number said the three methods we use the ballot box industrial action what we used to call insurrection but we now politely call direct action the ballot box will not become available to us unless we force the issue through industrial action and through direct action he praised protests by the police federation the doctors union and moves by shareholders to curb excess bonuses and pay packages for chief executives function e undefined track e function if player if object commercial video a o commercial and category if a video package c sponsorship number commercial video package a c i player else t function t number number i havent lived long enough to see number police officers march in london to see the call for action by doctors themselves and to see shareholders slap in the face in terms of individual chief executives to prevent them having their salaries he said now i dont know about you but i think that makes this a revolutionary moment said that he was delighted that ad boss sir martin had seen his bumper pay deal rejected by shareholders function e undefined track e function if player if object commercial video a o commercial and category if a video package c sponsorship number commercial video package a c i player else t function t number number just to see martin face when he lost pound number million at that was fucking wonderful wasnt it get really into them in their faces some of us have waited for a generation for this this is a classical marxist crisis of capitalism whats interesting in government they recognise it now in wall street they recognise it now in the city of london they recognise it now why the fuck dont the labour party recognise it now ive got to stop swearing at a unite the resistance conference in november number praised the occupy london movement and those campaigners who had set up a protest camp at st cathedral wherever theres an occupation we automatically support it and when those bailiffs come we go into non violent resistance in support of those occupations function e undefined track e function if player if object commercial video a o commercial and category if a video package c sponsorship number commercial video package a c i player else t function t number number if the bailiffs come to st or square and we know from st its committed christians who want to form a ring of prayer around them what we want to do is surround them with a ring of working class solidarity he hailed the occupation of an empty bank building in the city which was taken over by protestors i welcome the occupation yesterday of the bank yesterday what a fantastic initiative and breakthrough that is turning it into a bank not of money but of ideas of how we change the system itself also said that he hoped the planned demonstrations that month were more than just a few picket lines and would instead be a blockade of the i think we should use organised labour to help them bring the city to a halt at a right to work peoples convention in number he added what were about is were about bringing this government down theres no other way theyre not going to compromise a spokesman for told uk it is well documented that john has been a long time campaigner and activist as a backbencher fighting for workplace rights and standing up for those workers being overlooked by the political establishment conservative mp luke hall said that just as with the copeland by election the shadow chancellors remarks underlined the gap between labour and mainstream voters labour dont want to help people get on in life they want to bring the country into chaos and disarray he said labour are no longer speaking for ordinary working people the conservatives are the only party building a country that works for everyone not just the privileged few this feed and its contents are the property of the post uk and use is subject to our terms it may be used for personal consumption but may not be distributed on a	http://www.huffingtonpost.co.uk/2017/02/28/john-mcdonnell-defy-strike-laws-insurrection-tory-social-criminals-try-them-marxist-crisis-of-capitalism-unite-the-resistance_n_15063830.html?utm_hp_ref=uk&ir=UK	HuffPostUK
123	1488301848	moonlight cast where have you seen the stars of the oscar winning film before	it had already received plenty of buzz but now that its been named best picture at the number academy awards eventually after a bit of confusion that saw la la land briefly announced as the winner moonlight is the film that talking about from the cinematography to the representation and storytelling on screen critics have almost unanimously lauded barry film but its the actors received the most praise from cinema goers and reviewers alike for those seen the film but were wondering where theyd seen certain members of the cast before heres our handy guide to their film credits prior to moonlight is the first actor seen in moonlight and his as juan won him the award for best supporting actor at the number academy awards house of cards fans will recognise as danton a role which started off fairly minor but has risen to a more prominent position within the cast as the series progressed he also portrayed the personal bodyguard to in the hunger games saga you might also have caught his performance in another of the years biggest oscar nominated films hidden figures which co starred fellow moonlight actor mone harris harris gives one of moonlights stand out performances as who struggles with drug addiction and is one of two cast members to be nominated for an oscar shes definitely among the most prolific and recognisable members of the cast largely due to having starred in the james bond franchise as as well as playing in the long walk to freedom opposite mone is one of the few actors to star in more than one of the films acts playing in two separate time periods in the film while shes well established in the entertainment industry shes best known for her music career with six grammy nominations under her belt to date as well as collaborations with prince and in number she topped the uk singles chart in collaboration with fun on their song we are young and while her acting credentials are still in the low numbers she won critical acclaim for her performance in hidden figures i little is one of three actors who plays the lead role of in moonlight portraying the character as a child being just number years old its understandable that wouldnt have the longest of but what might come is a surprise that his role in moonlight is his first ever acting credit he told the independent the story is that im in a drama programme at my school and one day my teacher told all the boys to go for the audition i didnt know it was going to be that big so i just went did what i had to do and got two more callbacks then i got it easy as that eh sanders ii is the second actor to portray specifically playing him during his tumultuous teenage years during which he makes several dramatic steps in his character development while you might know him from one episode of the number web series the skinny and if you managed not to blink have also witness his performance as kid in straight moonlight is undoubtedly his biggest gig to date but we dont think the number year old actor will have to look far for roles anymore ii performance as teenage is pivotal to the films narrative hes one of moonlights lesser known stars with his only other acting credit being as the narrator in wheels a short film about a teenager who has recently become paralysed rhodes iii black previously auditioned for the role of but wound up bagging the more principal part of in his oldest incarnation instead prior to moonlight he appeared in the first episode of as well as bit parts in films but what might surprise you is that he was also a track and field sprinter even winning a gold medal in the pan american junior championships in number holland iii black is one of just two characters in moonlight to be played by multiple actors with andre holland playing him in his adult state you might recognise him for playing activist andrew young in and sportswriter smith in the film number hes also established in the small screen too most recently in the latest and scariest ever series of american horror story as matt miller in roanoke moonlight is out now in uk cinemas function e undefined track e function if player if object commercial video a o commercial and category if a video package c sponsorship number commercial video package a c i player else t function t number number this feed and its contents are the property of the post uk and use is subject to our terms it may be used for personal consumption but may not be distributed on a	http://www.huffingtonpost.co.uk/2017/02/28/moonlight-cast-actors-where-before-past-roles_n_15063684.html?utm_hp_ref=uk&ir=UK	HuffPostUK
124	1488301266	number year old woman gets arrested as part of her bucket list loves every minute	function e undefined track e function if player if object commercial video a o commercial and category if a video package c sponsorship number commercial video package a c i player else t function t number number a number year old woman was arrested and placed in a police cell all to tick another life experience off her bucket list annie was placed in a cell in the netherlands after contacting the officers in charge several photos of annie whose surname has not been published were posted by the station staff on in the images she is seen grinning while staff handcuff her and guide her into the cell peter smit a lieutenant at the police station told the independent annie was only in the cell for a couple of minutes adding she wanted to be in a police cell because of her bucket list in her life she never committed any crime and thought it would be exciting to experience as you can see in the picture from our found it hilarious to be in the inside with the handcuffs the photos have been liked more than number times and have left us wondering what else annie has planned for her bucket list whatever it is we hope she keeps smiling function e undefined track e function if player if object commercial video a o commercial and category if a video package c sponsorship number commercial video package a c i player else t function t number number this feed and its contents are the property of the post uk and use is subject to our terms it may be used for personal consumption but may not be distributed on a	http://www.huffingtonpost.co.uk/2017/02/28/99-year-old-woman-gets-arrested-as-part-of-her-bucket-list_n_15063464.html?utm_hp_ref=uk&ir=UK	HuffPostUK
125	1488299807	benedict is returning to our tv screens but not as sherlock holmes	function e undefined track e function if player if object commercial video a o commercial and category if a video package c sponsorship number commercial video package a c i player else t function t number number weve got sort of good for sherlock fans in need of their next benedict fix as the actor will be back on tv screens later this year however hes not returning as the trusty detective but instead will play the lead role in the new sky atlantic drama the five episode series will be written by david and will be based on the semi autobiographical patrick novels which were penned by edward st the role has been a longtime dream for benedict who will also be an executive producer as he named patrick as the character he would most love to play during a ama back in number sky have promised that the series will be a true television saga both gripping and and david has shared his excitement in a statement which reads ive been a huge admirer of edward st novels for years and cant wait to bring these dark witty brilliant books to the screen benedict is the perfect patrick meanwhile sherlock fans face a long wait before seeing the star back in number baker street with martin freeman and the shows creator has even suggested that we might have seen the last of the drama production on will begin in july function e undefined track e function if player if object commercial video a o commercial and category if a video package c sponsorship number commercial video package a c i player else t function t number number this feed and its contents are the property of the post uk and use is subject to our terms it may be used for personal consumption but may not be distributed on a	http://www.huffingtonpost.co.uk/2017/02/28/benedict-cumberbatch-melrose-sky-atlantic_n_15062764.html?utm_hp_ref=uk&ir=UK	HuffPostUK
126	1488299475	man surprised his parents with pregnancy announcement one day before his wife gave birth	a man decided to keep his a secret from his parents until they visited a day before the baby was born tannin pease and his wife who already have two children had experienced two miscarriages so didnt want to share the pregnancy too soon seeing as peases parents lived far away from them they decided to keep the secret going a bit longer and surprise them with an announcement later on we had already been through two miscarriages where we told people we were pregnant and then we had to tell them we werent anymore pease told abc the couple filmed the moment tannins parents walked into the door and saw his wifes bump tannins mum was initially distracted by saying hello to her other grandchildren so he had to prompt her by saying they had a surprise at that point walked in much to the grandmothers shock cue her gasping laughing and screaming as she went over to hug her daughter in law tannin shared the video on on number february and it was viewed nearly number times in just over a week the couples son saul was born just one day after the surprise announcement a lot of people they were wondering how on earth we did it said but it just worked out i guess people eventually saw us and a couple of pregnancy photos and a picture of the baby and were like you really did it function e undefined track e function if player if object commercial video a o commercial and category if a video package c sponsorship number commercial video package a c i player else t function t number number this feed and its contents are the property of the post uk and use is subject to our terms it may be used for personal consumption but may not be distributed on a	http://www.huffingtonpost.co.uk/2017/02/28/dad-suprises-parents-wife-pregnancy_n_15062752.html?utm_hp_ref=uk&ir=UK	HuffPostUK
