	time	title	summary	link	source
133	1488297863	number did captain of missing malaysia airlines flight murder everyone on board	as the mystery of what happened on board malaysia airlines flight number continues the finger of blame has been pointed once more at the actions of a rogue pilot the bound flight with number souls on board captained by shah went missing an hour into its departure from on number march number more than number items of debris suspected or confirmed to be from the plane have washed ashore on coastlines throughout the indian ocean since then but a deep sea sonar search for the main underwater wreckage has yielded nothing crash expert larry met with investigative journalist mark williams thomas to discuss the fate of the missing airliner on this morning is certain only one theory can account for what happened to the boeing number that it was brought down intentionally by a pilot he said this is a mass murder theres no other explanation for it i believe that one of the pilots in the cockpit took the aircraft and landed it deliberately in the ocean so that it would remain basically in one piece and sink to the bottom and never be seen again the first piece of wreckage found was a manually operated part from the plane wing with williams thomas remarking whats crucial about this piece of wreckage is that it was found in the extended position which could only have been done by the pilot to land the plane retired airline pilot marshall was then asked if it would be possible for a plane of that size and with that many passengers on board to hit the water without breaking up the impact would be survivable he admitted speaking in july told number minutes program somebody was flying the airplane into the water comments are believed to have highlighted to search crews that if the plane was piloted until it hit the water and thus contrary to the hypothesis it was not under human control when it crashed it could have landed outside of the search area added everybody should then have concluded in my opinion that this was a human engineered event theres no other explanation while the theory that shah committed suicide and killed everyone else on board is a common one it is at odds with that which suggests the crash was an act of heroism rather than hijacking in an online thesis australian aviation enthusiast michael gilbert speculates shah if it was indeed him at the controls at the time deliberately steered the plane which had suffered an on board fire off course to avoid a densely populated city thus saving lives type type related number based on the research of maintenance records and previous accidents gilbert surmises a windshield heater fire could have triggered the planes turn off course in an attempt to divert to an airport in penang with evidence of an oxygen leak in the cockpit causing the blaze to intensify quickly faulty windshield heaters have previously caused fires forcing aircraft to divert to nearby airports whats more gilbert explains a windshield heater fire can explain both the loss of the transponder signal and the interruption to the satellite communications link the subsequent failure of the windshield would have extinguished the fire but also caused a rapid gilbert adds within number number minutes of the event number number minutes before reaching penang almost everybody on board would have been dead but gilbert believes one of the pilots survived the fire and event because they were wearing breathing apparatus or possibly because they were outside the cockpit retrieving an extra fire extinguisher when the windshield failed gilbert writes on approaching penang the surviving pilot would have come to the realisation that he had no means of communication radio communication panel keypads microphones and headsets would have been burned or melted by the fire the pilot would have also realised that there was no reasonable chance of manually flying the airplane he had no instruments it was night there was no moon he could only occupy the cockpit for short periods of time and oxygen supplies were dwindling any attempt to take manual control of the airplane would almost invariably end with loss of control and there would be no guarantee that he could re engage the autopilot if he disengaged it gilbert points out that just off the starboard wing was penang with its population of number people and that immediately ahead lay the strait of malacca the worlds second busiest shipping lane given the situation i believe that the pilot then elected to do what many pilots in stricken airplanes have done in the past steer it clear of populated areas according to gilberts theory the surviving pilot will have been exposed to number temperatures for over an hour and would have been suffering from hypothermia when he decided to simply point the airplane in the safest possible direction before succumbing to hypoxia himself gilbert believes number eventually ran out of fuel and came down around number north of the search area highlighted by the australian transport safety bureau in january the deep sea search for the missing airliner officially ended leaving its final resting place one of the worlds greatest aviation mysteries despite every effort using the best science available the search has not been able to locate the aircraft malaysian australian and chinese authorities said in a statement the decision to suspend the underwater search has not been taken lightly nor without sadness function e undefined track e function if player if object commercial video a o commercial and category if a video package c sponsorship number commercial video package a c i player else t function t number number this feed and its contents are the property of the post uk and use is subject to our terms it may be used for personal consumption but may not be distributed on a	http://www.huffingtonpost.co.uk/2017/02/28/mh370-did-captain-of-missing-malaysia-airlines-flight-murder-everyone-on-board_n_15062030.html?utm_hp_ref=uk&ir=UK	HuffPostUK
134	1488297073	kim reveals her father sexually abused her as a child during loose women appearance	function e undefined track e function if player if object commercial video a o commercial and category if a video package c sponsorship number commercial video package a c i player else t function t number number kim has revealed she was sexually abused by her father as a young child the celebrity big brother star opened up about her traumatic childhood as she appeared on loose women on tuesday number february after the panel had discussed the effect childhood memories have on you later in life posed the question to kim with her saying shed had a tough time growing up i was very unloved she admitted my mothers favourite expression was if id known what you were going to be id have sent you back you never get over it but i dont let if affect my life asked about her relationship with her father kim went on my dad was a royal marine and he was a naughty man a bit of a touch of the old naughty bits with me when he could get away with it attempting to clarify what exactly she meant panellist janet street porter asked her if the abuse was sexual to which kim confirmed it was i was very young she said i remember my mother used to beat me up with carpet brushes smash them onto here smash them onto there asked if her mother ever believed her kim explained shed actually never told her i didnt know how to tell her the former how clean is your house star said dont forget when i was a little girl we didnt discuss that kind of thing you know what it did to me was believe it or not having seen me on big brother im a very kind person she continued im a softie im a soft silly old fool of a woman but dont start on me for no reason other than you want to get me out of a house because i will crucify you appearance on the daytime show also featured some lighter moments when she turned the air blue when discussing her celebrity big brother host was forced to apologise after kim branded her fellow reality stars bastards loose women airs weekdays at number on rape crisis services for women and girls who have been raped or have experienced sexual violence number number number survivors uk offers support for men and boys number number number function e undefined track e function if player if object commercial video a o commercial and category if a video package c sponsorship number commercial video package a c i player else t function t number number this feed and its contents are the property of the post uk and use is subject to our terms it may be used for personal consumption but may not be distributed on a	http://www.huffingtonpost.co.uk/2017/02/28/kim-woodburn-loose-women-sexually-abused-father-child_n_15061636.html?utm_hp_ref=uk&ir=UK	HuffPostUK
135	1488306232	asks for pound number fund to guard uk car industry	japan group says government must attract suppliers to assure sunderland plants future	http://www.ft.com/cms/s/0/9bd3e876-fddc-11e6-96f8-3700c5664d30.html?ftcamp=published_links%2Frss%2Fhome_uk%2Ffeed%2F%2Fproduct	FTUK
136	1488298692	are emerging markets entering a new virtuous cycle	optimism over growth and returning investment on the back of chinese demand is offset by fears of problems ahead	http://www.ft.com/cms/s/0/1ff85e96-f9ca-11e6-9516-2d969e0d3b65.html?ftcamp=published_links%2Frss%2Fhome_uk%2Ffeed%2F%2Fproduct	FTUK
137	1488309317	auction for book deal tops number	two memoirs by former president and first lady kick off blockbuster bidding war	http://www.ft.com/cms/s/0/6da8931a-fde2-11e6-96f8-3700c5664d30.html?ftcamp=published_links%2Frss%2Fhome_uk%2Ffeed%2F%2Fproduct	FTUK
138	1488308389	greens pension hole plug greeted with faint praise	tycoons pound number injection into insolvent fund seen as important step towards justice	http://www.ft.com/cms/s/0/06ec9838-fddd-11e6-96f8-3700c5664d30.html?ftcamp=published_links%2Frss%2Fhome_uk%2Ffeed%2F%2Fproduct	FTUK
139	1488303276	may warned over leaving eu without trade deal	british chambers of commerce and george alarmed by risk of hard brexit	http://www.ft.com/cms/s/0/121df63c-fdcb-11e6-8d8e-a5e3738f9ae4.html?ftcamp=published_links%2Frss%2Fhome_uk%2Ffeed%2F%2Fproduct	FTUK
140	1488326547	to challenge ministers on industrial strategy	carolyn to urge government to sharpen focus amid queries over brexit deals	http://www.ft.com/cms/s/0/49d16a9e-fdd7-11e6-96f8-3700c5664d30.html?ftcamp=published_links%2Frss%2Fhome_uk%2Ffeed%2F%2Fproduct	FTUK
141	1488302381	india faces another tryst with destiny	the country has a good chance of becoming the worlds fastest growing large economy	http://www.ft.com/cms/s/0/b351b50a-fcec-11e6-8d8e-a5e3738f9ae4.html?ftcamp=published_links%2Frss%2Fhome_uk%2Ffeed%2F%2Fproduct	FTUK
142	1488273561	the s p number charts that make bulls skittish	by a variety of metrics us share prices are in rare territory	http://www.ft.com/cms/s/0/7d261c56-fd59-11e6-96f8-3700c5664d30.html?ftcamp=published_links%2Frss%2Fhome_uk%2Ffeed%2F%2Fproduct	FTUK
143	1488302683	shot at selling espresso to the italians	seattle coffee chain seeks taste of la dolce vita with push in milan	http://www.ft.com/cms/s/0/d130b562-fdc8-11e6-8d8e-a5e3738f9ae4.html?ftcamp=published_links%2Frss%2Fhome_uk%2Ffeed%2F%2Fproduct	FTUK
144	1488323496	fed officials talk up rate rise prospects	william dudley argues case for an increase has become a lot more compelling	http://www.ft.com/cms/s/0/37520c36-fddf-11e6-96f8-3700c5664d30.html?ftcamp=published_links%2Frss%2Fhome_uk%2Ffeed%2F%2Fproduct	FTUK
145	1488322472	amazon failure disrupts key us	outage of web services platform hits dozens of businesses across america	http://www.ft.com/cms/s/0/b809c752-fded-11e6-96f8-3700c5664d30.html?ftcamp=published_links%2Frss%2Fhome_uk%2Ffeed%2F%2Fproduct	FTUK
146	1488306780	brussels to lay out plans for more multi speed eu number	drafts blueprint in response to uk exit from bloc	http://www.ft.com/cms/s/0/c56f99de-fdda-11e6-8d8e-a5e3738f9ae4.html?ftcamp=published_links%2Frss%2Fhome_uk%2Ffeed%2F%2Fproduct	FTUK
147	1488294509	trump says revved up economy will fund military boost	president to ask congress for number rise in us defence budget offset by cuts elsewhere	http://www.ft.com/cms/s/0/ad67b532-fd0e-11e6-8d8e-a5e3738f9ae4.html?ftcamp=published_links%2Frss%2Fhome_uk%2Ffeed%2F%2Fproduct	FTUK
148	1488318399	biblical cast out supporting companies	new listed funds buck liberal trend in targeted investing	http://www.ft.com/cms/s/0/7dad0cee-fdf3-11e6-8d8e-a5e3738f9ae4.html?ftcamp=published_links%2Frss%2Fhome_uk%2Ffeed%2F%2Fproduct	FTUK
149	1488293377	loses senior staff ahead of janus merger	heads of global equities and us credit among the departures	http://www.ft.com/cms/s/0/a7b517f4-fdb5-11e6-96f8-3700c5664d30.html?ftcamp=published_links%2Frss%2Fhome_uk%2Ffeed%2F%2Fproduct	FTUK
150	1488328946	four year olds to be taught not to cuddle strangers with sex ed to be made compulsory in all schools	four year olds are to be taught not to cuddle strangers in a major sex education shake up backed by may ministers are set to announce lessons on sex and relationships will be made compulsory in all schools the teaching reforms will see secondary school kids taught about the dangers of pornography and online grooming the	https://www.thesun.co.uk/uncategorized/2979733/new-compulsory-sex-education-classes-will-teach-tots-as-young-a-four-not-to-cuddle-strangers/	SunUK
151	1488328642	terrified pony callously dumped in school playground by travellers finds food and shelter thanks to the sun	the bedraggled little pony abandoned by travellers when they invaded a school was safe in a warm stable last night thanks to the sun a team of cops and bailiffs were involved in a tense four hour eviction stand off after number caravans pitched up on the school car park over half term nearly	https://www.thesun.co.uk/news/2979893/terrified-pony-callously-dumped-in-school-playground-by-travellers-finds-food-and-shelter-thanks-to-the-sun/	SunUK
152	1488328341	police force that caught schoolgirl sarah killer gave nearly number warning over child porn pics	the police force that caught schoolgirl sarah murderer visits to warn them about their behaviour the sun can reveal number perverts suspected of viewing the lowest level of child abuse images last year were visited at home by officers a total of number were handed letters telling them their behaviour was being monitored	https://www.thesun.co.uk/news/2979230/police-force-that-caught-schoolgirl-sarah-paynes-killer-gave-nearly-100-paedos-warning-over-child-porn-pics/	SunUK
153	1488328027	singapore deported for spending too long with dying parents spent number years of number year marriage to brit abroad say officials	a whose deportation caused outrage because she had lived here for number years has spent more than number years of her number year marriage to a brit in singapore officials insisted yesterday big hearted well wishers have so far poured nearly pound number into a fund to help her launch a legal bid to come back to the	https://www.thesun.co.uk/news/2979351/singapore-gran-deported-for-spending-too-long-with-dying-parents-spent-15-years-of-27-year-marriage-to-brit-abroad-say-officials/	SunUK
154	1488327411	thousands sign petition for threatened with eviction by care home bosses who want his loyal dog out	an elderly pensioner says he has been threatened with eviction by care home bosses over claims his dog is causing too much trouble a petition to let robert harvey known as bob keep his dog has now been signed by more than number people bob number said he was first told that his schnauzer must	https://www.thesun.co.uk/news/2980079/petition-bob-dog-out-scotland/	SunUK
155	1488327106	police station evacuated after member of the public strolls in with two artillery shells in a canvas bag	a police station was evacuated after a member of the public strolled in with two artillery shells in a canvas bag and handed them in at the front desk kingston police station had to be cordoned off after the shells designed to hold explosive ammunition were handed in officers closed the station in south west	https://www.thesun.co.uk/news/2980217/police-station-evacuated-after-member-of-the-public-strolls-in-with-two-artillery-shells-in-a-canvas-bag/	SunUK
156	1488326499	march number premium bonds winning numbers have you become an overnight millionaire	two lucky celebrating the start of spring after the top pound number million prize in premium bonds draw the pair from devon and outer london are the number and number millionaires to be made by since the bigger jackpot prize was introduced in number premium bonds are the biggest	https://www.thesun.co.uk/news/2975985/march-2017-premium-bonds-winning-numbers-million-pound-jackpot/	SunUK
157	1488326342	legendary reporter buckland dead at number after a long battle with cancer	fleet street legend buckland died yesterday after a long battle with cancer aged number he was a political reporter columnist and foreign correspondent for many national newspapers including the sun the of the world and the daily mirror his passion for journalism began aged eight when he ran away from home in	https://www.thesun.co.uk/news/2979906/legendary-reporter-chris-buckland-dead-at-73-after-a-long-battle-with-cancer/	SunUK
158	1488325983	british car makers plan to create number jobs in next two years as they look to post brexit future	british car makers plan to create number jobs in the next two years despite post brexit fears a report says some number per cent of the number firms in the supply chain plan to take on staff at an average of number each bank found it also said that regardless of last eu quit	https://www.thesun.co.uk/news/2978572/british-car-makers-plan-to-create-85000-jobs-in-next-two-years-as-they-look-to-post-brexit-future/	SunUK
159	1488325126	police reveal woman was stabbed repeatedly in apparent murder suicide as tributes paid to lovely couple	police have revealed that a woman was stabbed repeatedly in an apparent murder suicide as tributes are paid to a lovely couple sarah and richard were found dead at their home in suffolk at about number on sunday the husband and named locally by shocked residents who are still reeling from their	https://www.thesun.co.uk/news/2979917/cops-reveal-woman-was-stabbed-repeatedly-in-apparent-murder-suicide-as-tributes-paid-to-lovely-couple/	SunUK
160	1488324594	last chance for a place on our sun scholars scheme to study at a top university during the summer	you only have until tomorrow to try for a place on our brilliant sun scholars scheme sixth form students will go to summer school for a week at top universities including cambridge bristol durham and the royal veterinary college your travel and food are paid for by the trust charity donna holmes number was	https://www.thesun.co.uk/news/2979928/last-chance-for-a-place-on-our-sun-scholars-scheme-to-study-at-a-top-university-during-the-summer/	SunUK
161	1488324213	claims pal karen was regularly attacked in prison leaving her with black eyes after fake kidnap	karen got a good hiding in prison and was regularly attacked leaving her with black eyes according to pal was jailed after she orchestrated her own daughters kidnapping in a bid to claim pound number in reward money who led the search for still visited karen behind bars	https://www.thesun.co.uk/news/2979852/julie-bushby-karen-matthews-attacked-prison-black-eyes/	SunUK
162	1488322312	chancellor philip accused of sexism after telling female mp dont be hysterical	chancellor philip has been accused of sexism after telling a female mp dont be hysterical in the house of commons shot the jibe at mp mary creagh after she asked for reassurances for uk businesses to stop them moving to ireland because of brexit the chancellor retorted i would urge her not to	https://www.thesun.co.uk/news/2978675/chancellor-philip-hammond-accused-of-sexism-after-telling-female-mp-dont-be-hysterical/	SunUK
163	1488321608	number animals dead in just four years report reveals horror at south lakes safari zoo where tiger mauled keeper to death	almost number animals have died or been put down in four years at a zoo where a keeper was mauled to death by a tiger a damning report reveals the toll at south lakes safari zoo includes a jaguar that chewed off one of its paws a rhino that was crushed to death and two	https://www.thesun.co.uk/news/2979045/500-animals-dead-in-just-four-years-report-reveals-horror-at-south-lakes-safari-zoo-where-tiger-mauled-keeper-to-death/	SunUK
164	1488319529	was forced to follow this chilling list of rules during her number days of captivity during fake kidnap	a of rules including commands to not make any noise and never go near the windows that nine year old forced to obey has been revealed the little girl was kept in horrific conditions for number days after being used in an elaborate plot orchestrated by her mother and accomplice michael donovan to share	https://www.thesun.co.uk/news/2834197/shannon-matthews-kidnap-karen-list-rules-kidnapping/	SunUK
165	1488319143	local cop steve kinchin says karen kidnap plot was driven by greed as he backs claims others were involved in disappearance	karen was driven by greed when she devised the fake kidnap plot of her daughter according policeman steve kinchin cop steve kinchin a friend of who led the hunt for backs her claims that others were involved in the abduction but he says karen and michael	https://www.thesun.co.uk/news/2979263/steve-kinchin-karen-matthews-greed-shannon/	SunUK
166	1488318656	footballer harry kanes girlfriend shows off her slim figure just a month after giving birth to their first child	harry kanes girlfriend had shown off her trim post baby body a month after she gave birth to their daughter strikers long term partner was snapped in skintight workout gear on monday after a gym workout in essex the fitness instructor who gave birth to little ivy in february has dated the	https://www.thesun.co.uk/news/2979056/tottenham-striker-harry-kane-kate-goodland-baby/	SunUK
167	1488318431	seven million brits have no close friends and one in five feel lonely all the time research reveals	one in eight adults seven million people do not have a close friend a study found researchers said the number with no best mates has soared from one in ten the previous year they also found one in five adults felt lonely often or all of the time the most common number of	https://www.thesun.co.uk/news/2978968/seven-million-brits-have-no-close-friends-and-one-in-five-feel-lonely-all-the-time-research-reveals/	SunUK
168	1488318107	the squalid bedroom where nine year old was found tied to a bed by mum karen and michael donovan	these chilling pictures show the horrendous conditions nine year old was subjected being kidnapped by her mother karen and her accomplice michael donovan disappeared on her way home from a swimming lesson at primary number in a case that shocked the nation hundreds of neighbours joined which cost west yorkshire	https://www.thesun.co.uk/news/2833963/shannon-matthews-bedroom-tied-karen-michael-donovan/	SunUK
169	1488318031	wedding guests rushed to hospital after number plunge when staircase they were standing on collapsed during celebratory	guests at a wedding were rushed to hospital after a staircase collapsed as they posed for celebratory photos newlyweds andrew number and amy number had just tied the knot when the hotel steps came crashing down injuring at least number the wedding party fell at least ten feet suffering injuries to their legs	https://www.thesun.co.uk/news/2978934/wedding-guests-rushed-to-hospital-after-10ft-plunge-when-staircase-they-were-standing-on-collapsed-during-celebratory-photoshoot/	SunUK
170	1488326400	she sounds shrill sturgeon ridiculed over manufacturing synthetic brexit grievance	nicola sturgeon has been accused of cooking up synthetic grievance about brexit after she claimed the uk government is using its european union divorce to attack the very foundations of scottish powers	http://feedproxy.google.com/~r/daily-express-uk-news/~3/ToXHSoMpcYQ/Nicola-Sturgeon-Scottish-First-Minister-Brexit-EU-single-market-Ruth-Davidson	DailyExpressUK
171	1488326460	lonely britain seven million brits do not have close friends to spend time with	seven million britons do not have a close friend to confide in or spend time with as the number of people feeling lonely rises warns a new report	http://feedproxy.google.com/~r/daily-express-uk-news/~3/tPrJj2klYxY/lonely-brits-seven-million-no-close-friends-confide-spend-time-adults-social-care	DailyExpressUK
172	1488326460	d day hero robbed during hospital stay thanks daily express readers for kind donations	a d day veteran who needed new clothes after his were destroyed during emergency medical treatment has thanked big hearted daily express readers who hit a fundraising target to help him in a matter of hours	http://feedproxy.google.com/~r/daily-express-uk-news/~3/V6qC-1bSNMg/D-Day-hero-robbed-hospital-Daily-Express-readers-donations	DailyExpressUK
173	1488326460	scam warning over number warned not to be flattered by investment	people aged over number are being warned not to let investment flatter them into parting with their cash with the average victim of the scam losing more than pound number	http://feedproxy.google.com/~r/daily-express-uk-news/~3/AAxHO4k2au8/scam-warning-over-55s-warned-beware-investment-fraudsters	DailyExpressUK
174	1488326460	revealed more than two million working households struggling with money worries	more than two million working households across the uk are struggling with money worries according to which estimates	http://feedproxy.google.com/~r/daily-express-uk-news/~3/oLz3M9IkHiU/Millions-of-households-struggling-with-money	DailyExpressUK
