	time	title	summary	link	source
64	1488195480	child migrant tells abuse inquiry name villains	a former child migrant who broke down giving evidence to the independent inquiry into child sexual abuse has called for the villains to be named	http://news.sky.com/story/children-forced-to-leave-uk-under-migrant-scheme-suffered-widespread-sex-abuse-10783953	SkyNewsUK
65	1488207480	child abuse inquiry in email addresses blunder	the email addresses of people who registered to a child abuse victims forum have been shared with others in a blunder by the independent inquiry into child sex abuse	http://news.sky.com/story/child-abuse-inquiry-in-email-addresses-blunder-10784228	SkyNewsUK
66	1488184920	compensation bill hike hits nhs and insurers	insurers have condemned a crazy reform increasing for personal injury victims that they say will lead to steeply higher premiums for motorists as well as landing the nhs with a pound number bill	http://news.sky.com/story/crazy-compensation-bill-hike-to-hit-nhs-and-insurers-10783733	SkyNewsUK
67	1488200100	storm doris man dies after tree fell on car	a pensioner in a car crushed by a tree blown over when storm doris struck has died in hospital	http://news.sky.com/story/storm-doris-pensioner-dies-three-days-after-tree-fell-on-car-10784062	SkyNewsUK
68	1488150420	action needed to avoid nhs catastrophe	the government must take targeted action to avoid a catastrophic failure in the nhs an influential parliamentary committee has said	http://news.sky.com/story/government-warned-it-must-act-to-avoid-nhs-catastrophe-10783613	SkyNewsUK
69	1488143880	welsh rugby star number killed in car crash	the family of a welsh rugby international who was killed in a car crash have paid tribute to her saying she was loved and valued by many	http://news.sky.com/story/welsh-rugby-star-elli-norkett-20-killed-in-car-crash-10783515	SkyNewsUK
70	1488213094	house of lords seeks to add conditions to brexit notice	london unelected house of lords flirted on monday with changing the conditions under which the country will announce its departure from the european union threatening to attach amendments to prime minister mays legislation	http://feeds.reuters.com/~r/reuters/UKDomesticNews/~3/HHb92ufPjTQ/uk-britain-eu-article-idUKKBN1661WE	ReutersUK
71	1488217839	as brexit talks loom eu to dodge early clearing clash	brussels the european union will not pick an immediate fight with the city of london over its right to clear euro denominated securities eu officials said on monday as britain prepares to trigger the process of quitting the bloc	http://feeds.reuters.com/~r/reuters/UKDomesticNews/~3/Fj7j0UthgRQ/uk-eu-clearing-regulations-idUKKBN16622V	ReutersUK
72	1488217377	britons face surge in motor insurance premiums after rule change	london britons will have to pay much more for motor insurance after the government announced new rules on monday that will push up lump sum payments for personal injury claims	http://feeds.reuters.com/~r/reuters/UKDomesticNews/~3/3AeVeIxVkEw/uk-britain-insurance-discountrate-idUKKBN1660T8	ReutersUK
73	1488210527	three years on child sex abuse inquiry starts hearings	london inquiry into historical child sex abuse scandals some involving celebrities and politicians finally opened its first public hearing on monday after a sleuth of problems that led to three chairmen quitting in the three years since its launch	http://feeds.reuters.com/~r/reuters/UKDomesticNews/~3/iogC6C77zpw/uk-britain-abuse-inquiry-idUKKBN1661AY	ReutersUK
74	1488204194	to cut deputy manager roles at uk convenience stores	london biggest retailer is replacing number deputy managers at its express convenience stores with lower paid shift leaders in a restructuring of the business it said on monday	http://feeds.reuters.com/~r/reuters/UKDomesticNews/~3/WG2gmAepypE/uk-tesco-redundancies-idUKKBN1661KT	ReutersUK
75	1488184033	uk services optimism is highest since brexit vote	london optimism among businesses in services sector is now higher than at any time since vote to leave the european union despite the prospect of rising costs and prices eroding profits a major business survey showed on monday	http://feeds.reuters.com/~r/reuters/UKDomesticNews/~3/ucLUQSNJ7L8/uk-britain-economy-idUKKBN16600C	ReutersUK
76	1488182930	farage posts picture of dinner with the donald	london british anti eu campaigner nigel farage posted a picture of him having dinner with the donald on twitter the latest meeting between us president donald trump and the critic of prime minister may	http://feeds.reuters.com/~r/reuters/UKDomesticNews/~3/WmiF5aoklKQ/uk-usa-trump-britain-farage-idUKKBN1650G2	ReutersUK
77	1488198362	may sees settling eu citizens rights a priority in brexit talks	london british prime minister may wants to settle the question of the rights of eu citizens living in britain as a priority in talks to leave the european union but has not set a timetable for her migration policies her spokesman said on monday	http://feeds.reuters.com/~r/reuters/UKDomesticNews/~3/9F7KKhhySVQ/uk-britain-eu-immigration-idUKKBN1661BW	ReutersUK
78	1488189275	poland sees number number poles coming home after brexit	warsaw between number and number poles living in britain may return home as a result of britain leaving the european union a polish government ministry said on monday	http://feeds.reuters.com/~r/reuters/UKDomesticNews/~3/SK2xqI-vSWA/uk-britain-eu-poland-idUKKBN166120	ReutersUK
79	1488207329	acrimonious election campaign deepens northern ireland deadlock	belfast acrimonious campaigning ahead of thursday snap elections in northern ireland has increased antagonism between pro british unionists and irish nationalists and exacerbated fears devolved power may revert to london for the first time in a decade	http://feeds.reuters.com/~r/reuters/UKDomesticNews/~3/XipeGhL30z0/uk-nireland-politics-election-idUKKBN1661M9	ReutersUK
80	1488217513	in fear for their life government spending thousands to protect worried judges	tens of thousands of pounds are being spent by the ministry of justice to step up security measures for judges worried about their safety read full article at	https://www.rt.com/uk/378792-thousands-judges-safety-justice/?utm_source=rss&utm_medium=rss&utm_campaign=RSS	RTUK
81	1488216086	cash strapped royal navy cancels annual air show to focus on counter terror ops	royal navy is so strapped for cash that it has been forced to cancel its annual air show so that its helicopters can be used to protect the nations shipping fleet read full article at	https://www.rt.com/uk/378791-royal-navy-show-cancelled/?utm_source=rss&utm_medium=rss&utm_campaign=RSS	RTUK
82	1488210812	tory government cutting school funding for first time in decades ifs report	the uk government will cut school funding for the first time in two decades a new analysis by the institute for fiscal studies ifs claims read full article at	https://www.rt.com/uk/378783-government-school-funding-education/?utm_source=rss&utm_medium=rss&utm_campaign=RSS	RTUK
83	1488210684	jailing parents for female genital mutilation unlikely to benefit the child police	an english police force has come under fire for claiming the prosecution of parents who allow female genital mutilation of their children is unlikely to benefit the child read full article at	https://www.rt.com/uk/378782-fgm-police-prosecution-child/?utm_source=rss&utm_medium=rss&utm_campaign=RSS	RTUK
84	1488206520	soft coup against jeremy corbyn is already underway shadow chancellor	shadow chancellor john claimed this week that members of his own party are in cahoots with the media in a renewed attempt at bringing down the labour leader read full article at	https://www.rt.com/uk/378766-soft-coup-labour-corbyn/?utm_source=rss&utm_medium=rss&utm_campaign=RSS	RTUK
85	1488204600	is mays brexit strategy about to be derailed by number scottish	uk prime minister may fears first minister nicola sturgeon could call for a second scottish independence referendum the moment negotiations for exit from the eu are launched next month read full article at	https://www.rt.com/uk/378758-theresa-may-scotland-independence/?utm_source=rss&utm_medium=rss&utm_campaign=RSS	RTUK
86	1488200220	uncertainty over claims eu migrants could lose right to stay in uk within weeks	government sources have moved to dampen speculation that european migrants arriving in britain could lose their right to stay permanently starting next month read full article at	https://www.rt.com/uk/378750-eu-migrants-brexit-stay/?utm_source=rss&utm_medium=rss&utm_campaign=RSS	RTUK
87	1488197820	tory aide defends welfare cuts for less disabled people	a key aide to uk prime minister may has been branded insulting and nasty after suggesting during a radio interview that certain disabilities are more worthy of public funds than others read full article at	https://www.rt.com/uk/378741-tory-cut-disabled-benefits/?utm_source=rss&utm_medium=rss&utm_campaign=RSS	RTUK
88	1488195480	deporting homeless eu migrants breaks their free movement rights	eu citizens sleeping rough in the uk are being routinely deported under new immigration policies according to figures released under freedom of information read full article at	https://www.rt.com/uk/378739-eu-nationals-homeless-deportation/?utm_source=rss&utm_medium=rss&utm_campaign=RSS	RTUK
89	1488195106	gay afghans facing deportation from uk told pretend to be straight	gay afghans being deported to their home country where homosexuality is illegal are being told to pretend to be straight in new guidelines issued by the uk government read full article at	https://www.rt.com/uk/378738-gay-afghans-asylum-deport/?utm_source=rss&utm_medium=rss&utm_campaign=RSS	RTUK
90	1488187980	suspected shell discovered in e london prompts massive evacuation	a busy east london street was evacuated after what is believed to be a world war ii bomb was discovered on monday morning high street was closed off and nearby buildings evacuated read full article at	https://www.rt.com/uk/378714-bomb-london-evacuation-shoreditch/?utm_source=rss&utm_medium=rss&utm_campaign=RSS	RTUK
91	1488123060	uk terror threat at highest level since number says watchdog	the uk is at its highest risk of a terror attack since the ira bombing campaign of the number according to new watchdog for terrorism laws read full article at	https://www.rt.com/uk/378664-terror-threat-britain-ira/?utm_source=rss&utm_medium=rss&utm_campaign=RSS	RTUK
92	1488121918	london mayor backtracks after sparking row by likening scottish nationalism to racism	london mayor sadiq khan sparked a row in tweets preceding his latest speech by implying scottish nationalism is akin to racism he was forced to backpedal after first minister nicola sturgeon slammed his remarks as spectacularly ill judged read full article at	https://www.rt.com/uk/378663-london-mayor-nationalism-row/?utm_source=rss&utm_medium=rss&utm_campaign=RSS	RTUK
93	1488114420	dinner with the donald farage boasts of up to us president despite getting no invitation	former ukip leader nigel farage dined with president donald trump at his washington hotel on saturday although the is not thought to have been invited to the meal read full article at	https://www.rt.com/uk/378653-farage-dinner-trump/?utm_source=rss&utm_medium=rss&utm_campaign=RSS	RTUK
94	1487969340	uk police blind man after mistaking his cane for a gun	a blind man who was waiting for a train home was by police at a railway station in manchester england after someone reported that his walking stick was a firearm read full article at	https://www.rt.com/uk/378539-police-taser-blind-man/?utm_source=rss&utm_medium=rss&utm_campaign=RSS	RTUK
95	1487958600	honey offside trap bees taught to play football by scientists video	we have been severely underestimating the brain power and capabilities of bumble bees according to scientists who have taught them how to play soccer read full article at	https://www.rt.com/uk/378524-bees-learn-soccer-goal/?utm_source=rss&utm_medium=rss&utm_campaign=RSS	RTUK
96	1487957820	scotland seriously considering number in number and a german map maker is ready for it	the scottish government is seriously thinking about staging a second independence referendum next year triggering a mixed reaction within the eu read full article at	https://www.rt.com/uk/378522-scotland-brexit-eu-independence/?utm_source=rss&utm_medium=rss&utm_campaign=RSS	RTUK
97	1487956920	men are getting their beer belly fat removed injected into their penis	a state of the art cosmetic procedure now promises to help men concerned with the size of their genitals and the girth of their stomach simultaneously by using their unwanted fat as a penis enlarger read full article at	https://www.rt.com/uk/378517-fat-belly-injected-penis/?utm_source=rss&utm_medium=rss&utm_campaign=RSS	RTUK
98	1487956740	nut job prince charles backs fueled grey squirrel sterilization plan	prince charles has backed a government plan to sterilize grey squirrels by putting contraceptives in spread which tests show is highly attractive to the woodland critters read full article at	https://www.rt.com/uk/378516-prince-charles-squirrel-sex/?utm_source=rss&utm_medium=rss&utm_campaign=RSS	RTUK
99	1487956500	i wont resign corbyn staying put after copeland by election fail	labour leader jeremy corbyn is under pressure to resign after the party suffered a humiliating defeat in the copeland by election but prevailed in the hotly contested stoke central by election read full article at	https://www.rt.com/uk/378515-corbyn-copeland-election-labour/?utm_source=rss&utm_medium=rss&utm_campaign=RSS	RTUK
100	1488181087	game of thrones star and tallest man dies aged number	game of thrones star has died at the age of number it has been reported once named as tallest man the number star played mag the mighty in the fantasy series and also took on roles men first class and jupiter ascending a statement posted on the tall persons club group page on sunday read sadly it has come to our attention that tallest man passed away on saturday	https://uk.news.yahoo.com/game-thrones-star-britains-tallest-154619352.html	YahooUK
101	1488145171	call the midwife praised for brave episode tackling	viewers were moved by call the midwifes harrowing storyline	https://uk.news.yahoo.com/call-midwife-praised-brave-episode-213931459.html	YahooUK
102	1488192420	oscars host jimmy opens ceremony with trump jibe	oscars host jimmy thanked donald trump for making the less racist as he opened the number academy awards the talk show host said he knew the country was divided and he had been encouraged to say something that would unite people pointedly led a standing ovation for actress streep who criticised mr trumps impression of a disabled reporter during his campaign for the presidency saying it kind of broke my heart in her golden globes acceptance speech last month	https://uk.news.yahoo.com/oscars-host-opens-ceremony-trump-jibe-031300792.html	YahooUK
103	1488217342	every celebrity injury on the jump number so far		https://uk.news.yahoo.com/every-celebrity-injury-jump-2017-151614138.html	YahooUK
104	1488139699	boy wins texas girls wrestling championship	mack a number year old wrestler who identifies as male has won a texas state title in girls wrestling overcoming jeers from the crowd en route to a controversial championship several parents complained that was too strong to compete against girls while others expressed sympathy for him	https://uk.news.yahoo.com/transgender-boy-wins-texas-girls-200819734.html	YahooUK
105	1488213290	german hostage beheaded by philippine govt	islamic militants in the philippines have beheaded a number year old german hostage they were holding for ransom manila officials said monday as berlin condemned the murder as unscrupulous and inhumane	https://uk.news.yahoo.com/philippine-islamic-militants-kill-german-hostage-101749203.html	YahooUK
106	1488217377	britons face surge in motor insurance premiums after rule change	by carolyn london britons will have to pay much more for motor insurance after the government announced new rules on monday that will push up lump sum payments for personal injury claims the industrys trade body described the change as crazy as it would lead insurers to further increase motor insurance premiums which jumped number percent last year the personal injury lawyers trade group however said it was long overdue	https://uk.news.yahoo.com/britain-cuts-discount-rate-personal-injury-claims-blow-080401158--finance.html	YahooUK
107	1488138660	top female rugby player number killed in car crash after watching six nations	the number year old was driving a toyota which was involved in a collision with a insignia on the number inter valley road between and a number year old woman driving the and a number year old girl who was a passenger were taken to hospital with non life threatening injuries was a kind hearted and caring number year old final year student at met university studying sport development they said	https://uk.news.yahoo.com/top-female-rugby-player-20-195100647.html	YahooUK
108	1488210096	pakistani airline launches inquiry into extra passengers claim	the national carrier has been plagued by problems in recent years pakistan international airlines has said it is investigating reports that more passengers than the maximum allowed had travelled on an international flight adding that it had launched disciplinary measures against the crew a pia spokesman denied a newspaper report that seven extra passengers were forced to stand for the three hour flight from to medina in saudi arabia on number january	https://uk.news.yahoo.com/pakistan-airliner-flew-seven-extra-065208551.html	YahooUK
109	1488141956	lauds display and praises	celebrates scoring manchester winning goal during their number number efl cup final win over watched snatch what he admitted was a slightly undeserved final victory against and he joked that manchester supporters ought to camp outside the strikers house to persuade him to sign on for another season at the club united led at through goals from and jesse before new signing hit back with two goals of his own	https://uk.news.yahoo.com/jos-mourinho-lauds-zlatan-ibrahimovic-204556572.html	YahooUK
110	1488193920	moonlight star harris oscars blunder stole our moment	moonlight star harris has told sky she is disappointed the mix up over the best picture oscar spoiled the film crews celebrations	https://uk.news.yahoo.com/moonlight-star-naomie-harris-oscars-blunder-stole-moment-111200606.html	YahooUK
111	1488139592	le pen blames media as macron jumps in french polls	french far right leader marine le pen on sunday accused the media of campaigning hysterically in favour of macron her centrist rival for the presidency as polls showed him enjoying a jump in support	https://uk.news.yahoo.com/no-legal-let-french-candidates-face-probes-095421585.html	YahooUK
112	1488136380	the galaxy number has an official launch date	has revealed that its next flagship will launch on number march the galaxy number had been expected to make its first official appearance at number but the company decided to delay it because of the fallout surrounding the disastrous galaxy note number the galaxy number is heavily rumoured to be an number inch handset though a number inch number is also likely to launch alongside it	https://uk.news.yahoo.com/samsung-galaxy-s8-official-launch-191300121.html	YahooUK
113	1488163560	mardi gras crash suspect three times the legal limit	the driver of a pickup truck who is said to have ploughed into a crowd at a mardi gras parade in new orleans had a blood alcohol level nearly three times the legal limit the new orleans police department said number was being held at the jail facing charges of first degree negligent vehicular injuring hit and run driving causing serious injury and reckless operation of a vehicle police chief michael harrison said a breath test showed alcohol level was nearly three times the legal limit	https://uk.news.yahoo.com/twelve-critically-hurt-car-ploughs-crowd-orleans-021200068.html	YahooUK
114	1488148242	directors not players are undermining managers	takes his liverpool side to leicester on monday with the champions now following sacking has denied player power is on the rise and claimed the biggest threat to managers such as are directors with a direct line of communication to the dressing room was sacked as leicester city manager on thursday amid reports of a revolt among players he turned into premier league champions nine months previously	https://uk.news.yahoo.com/liverpool-j-rgen-klopp-directors-223042745.html	YahooUK
115	1488203606	pancake day number the best recipes and everything else you need to know	when is pancake day number pancake day has been celebrated by britons for centuries known also as shrove tuesday its exact date rather confusingly changes every year because it is determined by when easter falls pancake recipes how do i make pancakes	https://uk.news.yahoo.com/pancake-day-2017-best-recipes-151837095.html	YahooUK
116	1488146400	archbishops friend allowed to commit abuse failed to report him	the centre of a child abuse scandal committed a series of sickening assaults against young men after leading evangelical groups failed to report him to the police it is claimed john smyth a friend of the archbishop of canterbury is accused of carrying out sadomasochistic attacks on boys he met at christian camps in britain and zimbabwe the assaults first came to light in number when a victim attempted suicide after being summoned to a beating in the shed of mr winchester home	https://uk.news.yahoo.com/archbishops-qc-friend-allowed-commit-220000231.html	YahooUK
117	1488211320	coronation street spoiler she wants what plays hardball with steve	we take a look at whats coming up in coronation street this evening	https://uk.news.yahoo.com/coronation-street-spoiler-she-wants-160200328.html	YahooUK
118	1488137820	corbyn slips up as his deputy slams the labour leader cheerleaders	jeremy corbyn has mistakenly thanked nicola sturgeons scottish national party instead of his scottish labour during a speech intended to rally his party after a humiliating by election defeat speaking at the scottish labour party conference the labour leader said im delighted that scottish labour announced yesterday a new policy to use the powers of the scottish parliament to increase child benefit which will lift thousands of scottish children out of poverty pressure is mounting on the embattled leader following labours defeat by the conservatives in the copeland by election on thursday which has prompted calls from some labour for mr corbyn to quit	https://uk.news.yahoo.com/labours-tom-watson-where-jeremy-corbyns-cheerleaders-131300143.html	YahooUK
119	1488186480	oscars best picture gaffe sends twitter into frenzy	oscar and hilarity are swamping social media today after la la land was incorrectly given the best picture oscar when in fact moonlight was the winner the sixth sense director m night who made a name for himself with the dramatic twists in his films joked that he wrote the ending to the number academy awards the official miss universe tweeted some advice to the academy two years after us comedian steve harvey mistakenly announced the wrong winner during the crowning of the number miss universe	https://uk.news.yahoo.com/oscars-best-picture-gaffe-sends-twitter-frenzy-085900368.html	YahooUK
