	time	title	summary	link	source
133	1488209335	top gear evans hasnt spoken to matt since quitting the show	it seems there is no love lost between evans and matt the former friends star has revealed his old top gear co host has not spoken to him since quitting last year departed the two motoring show after just one series last july amid poor reviews and falling viewing figures but failed to tell matt about his decision and his avoided him since speaking to the sun ahead of the new series matt explained i did not know what was coming until i read that in the paper and also i havent heard from him since which is his choice despite keeping his distance matt has insisted they actually got on while they worked together i saw the stories that we werent getting along and there was a row between us but we were fine he said i liked evans i think my schedule is tough but he was doing a radio show every morning and that was a lot to deal with maybe that was what it was i honestly dont know the new series sees matt take the reins of the show alongside newly and harris who proved popular additions to the team in number producers will be hoping the new threesome are able to recapture the glory days the show enjoyed with jeremy richard and james may in the hot seat bosses decided ask matt to step up rather than hiring a new host last september with director of studios mark linsey saying at the time matt was hugely popular with top gear viewers last series with his humour warmth and obvious passion for cars and for the show so i couldnt be more delighted that hes agreed to come back and do more for us contributors jordan and sabine schmitz will also be returning for the new series top gear returns on sunday number march at number on two function e undefined track e function if player if object commercial video a o commercial and category if a video package c sponsorship number commercial video package a c i player else t function t number number this feed and its contents are the property of the post uk and use is subject to our terms it may be used for personal consumption but may not be distributed on a	http://www.huffingtonpost.co.uk/2017/02/27/top-gear-matt-leblanc-chris-evans-havent-spoken_n_15042594.html?utm_hp_ref=uk&ir=UK	HuffPostUK
134	1488207488	number disturbing things donald trump did over the weekend	number had dinner with nigel farage well at least thats what farage would want you to believe but take a close look at this picture dinner with the donald number nigel farage nigel farage february number number there are a few issues here best worst bits of this number farage doesnt look number the photographer is hiding in a number the guy guarding a wall of empty frames number matthew champion february number number oh and perhaps more importantly two things number farage was not invited to this dinner squeezed in at last number sec state is dining w wife alone across room benny february number number number and while were on the subject of donald trumps dinner this could be the most disturbing thing ever to feature in an edition of this is an excerpt from a brilliant piece by benny johnson who managed to book a table next to the one where trump and allegedly farage were dining trump is served his entree according to a waiter who wished to remain anonymous the president ordered a well done steak an aged new york strip he ate it with catsup as he always does the sides and appetizers on the table were shared three jumbo shrimp cocktails were delivered before the meal at one point the president looked at his watch and remarked they are filming saturday night live right now cant wait to see what they are gon na do to me this week it was hard to serve him because he is so funny and relaxed it makes you laugh steak well done with ketchup trump you absolute monster and if that wasnt bad enough donald trumps steakhouse serves bacon pegged to a mini fucking washing line number number york february number number number continued his attack on the media by throwing a hissy fit the annual white house correspondents association dinner has been a regular feature of the american political calendar for number years and is an opportunity to shine a spotlight on some of the best political journalism of the past year its also traditional that the president gets roasted by comedians something the notoriously thin skinned trump would probably not handle very well i will not be attending the white house correspondents association dinner this year please wish everyone well and have a great evening donald j trump february number number in fact he featured at number event as destroyed him as he sat in the audience with a face like a slab of cold orange granite glorious on a more serious note trumps announcement came just a day number of including the post were barred from a white house press briefing the soviet union eventually stopped using the stalinist term enemy of the people trump now embraces it number andrew february number number number annoyed his supporters by doing exactly what he said he would do an article in the new york times details the case of one juan a coal town that voted overwhelmingly for trump is upset that a longtime latino resident may get deported number number february number number number lets end on a bright note heres jimmy ripping trump at the oscars last night function e undefined track e function if player if object commercial video a o commercial and category if a video package c sponsorship number commercial video package a c i player else t function t number number this feed and its contents are the property of the post uk and use is subject to our terms it may be used for personal consumption but may not be distributed on a	http://www.huffingtonpost.co.uk/2017/02/27/trumpwatch-trump-watch_n_15041662.html?utm_hp_ref=uk&ir=UK	HuffPostUK
135	1488216018	trump wants number increase in military spending	funding rise of number to be offset by cuts in non defence budgets	http://www.ft.com/cms/s/0/ad67b532-fd0e-11e6-8d8e-a5e3738f9ae4.html?ftcamp=published_links%2Frss%2Fhome_uk%2Ffeed%2F%2Fproduct	FTUK
136	1488212668	sews up his turkish revolution	a referendum in april could give the president power beyond the scope of even	http://www.ft.com/cms/s/0/6337eb16-f85a-11e6-bd4e-68d53499ed71.html?ftcamp=published_links%2Frss%2Fhome_uk%2Ffeed%2F%2Fproduct	FTUK
137	1488218389	brexit donor banks under financial spotlight	allegations of serious and widespread failings while chief executive of group	http://www.ft.com/cms/s/0/fbf1b0d8-fd07-11e6-8d8e-a5e3738f9ae4.html?ftcamp=published_links%2Frss%2Fhome_uk%2Ffeed%2F%2Fproduct	FTUK
138	1488220097	balked at brussels demand without consulting d	uk exchanges rejection of call to sell its number stake in mts means merger likely dead	http://www.ft.com/cms/s/0/bf8c276a-fce7-11e6-96f8-3700c5664d30.html?ftcamp=published_links%2Frss%2Fhome_uk%2Ffeed%2F%2Fproduct	FTUK
139	1488220551	reveals apple stake of more than number	berkshire one of tech groups top five shareholders but will not be buying any more for now	http://www.ft.com/cms/s/0/6cb02caa-fcef-11e6-96f8-3700c5664d30.html?ftcamp=published_links%2Frss%2Fhome_uk%2Ffeed%2F%2Fproduct	FTUK
140	1488220542	faces review after best picture mix up at oscars	moonlight takes top prize after academy award mistakenly handed to la la land	http://www.ft.com/cms/s/0/4f04d7b8-fcb4-11e6-96f8-3700c5664d30.html?ftcamp=published_links%2Frss%2Fhome_uk%2Ffeed%2F%2Fproduct	FTUK
141	1488197220	le pen trump and the atlantic counter revolution	the two leaders share much including nationalism populism and protectionism	http://www.ft.com/cms/s/0/aaa5860c-fcce-11e6-8d8e-a5e3738f9ae4.html?ftcamp=published_links%2Frss%2Fhome_uk%2Ffeed%2F%2Fproduct	FTUK
142	1488171646	brexit effect shakes up london	currency falls and cheap capital clash with political uncertainty	http://www.ft.com/cms/s/0/2f1358ec-f9f0-11e6-bd4e-68d53499ed71.html?ftcamp=published_links%2Frss%2Fhome_uk%2Ffeed%2F%2Fproduct	FTUK
143	1488206170	india frets that american welcome is over	shooting of two indian engineers shakes new view of trump administration	http://www.ft.com/cms/s/0/c7a2b4ca-fcdb-11e6-8d8e-a5e3738f9ae4.html?ftcamp=published_links%2Frss%2Fhome_uk%2Ffeed%2F%2Fproduct	FTUK
144	1488219639	mays speech to head off scottish independence poll	address before tories to emphasise importance of upcoming local elections	http://www.ft.com/cms/s/0/43f094ca-f8f9-11e6-9516-2d969e0d3b65.html?ftcamp=published_links%2Frss%2Fhome_uk%2Ffeed%2F%2Fproduct	FTUK
145	1488198069	considers making electric mini outside uk	move to quit eu sparks uncertainty over where to manufacture battery driven car	http://www.ft.com/cms/s/0/a9ecd5aa-fcdb-11e6-8d8e-a5e3738f9ae4.html?ftcamp=published_links%2Frss%2Fhome_uk%2Ffeed%2F%2Fproduct	FTUK
146	1488171673	trump team looks to bypass dispute system	unilateral trade sanctions would test a pillar of the us built global economic order	http://www.ft.com/cms/s/0/7bb991e4-fc38-11e6-96f8-3700c5664d30.html?ftcamp=published_links%2Frss%2Fhome_uk%2Ffeed%2F%2Fproduct	FTUK
147	1488219967	who raises alarm over drug resistant	with millions of lives potentially at stake un agency issues call for new antibiotics	http://www.ft.com/cms/s/0/07ae84f2-fd06-11e6-96f8-3700c5664d30.html?ftcamp=published_links%2Frss%2Fhome_uk%2Ffeed%2F%2Fproduct	FTUK
148	1488213839	poland tries to rally opposition to donald tusk	warsaw may put forward candidate to stand against current european council president	http://www.ft.com/cms/s/0/d3876066-fd02-11e6-96f8-3700c5664d30.html?ftcamp=published_links%2Frss%2Fhome_uk%2Ffeed%2F%2Fproduct	FTUK
149	1488192407	worlds cheapest creator accused of fraud	india detains goel founder of number handset group over allegations	http://www.ft.com/cms/s/0/77ccc770-fccb-11e6-8d8e-a5e3738f9ae4.html?ftcamp=published_links%2Frss%2Fhome_uk%2Ffeed%2F%2Fproduct	FTUK
150	1488220449	simon burglar killed dad of one in hit and run just days after raid on x factor moguls home as shows criminal outside stars home minutes following pound number crime	a burglar who raided simon home killed a dad of one in a hit and run horror smash just days after the raid on the x factor moguls house shows the moment career criminal february broke into home in exclusive holland park west london in number stealing jewellery and passports worth almost pound number million	https://www.thesun.co.uk/news/2967845/simon-cowell-burglar-darren-february-guilty-killed-hit-and-run/	SunUK
151	1488220251	mum of three number searching for her missing wheelie bin shocked to discover footage of council worker chucking it into back of truck	a mum of three searching for her missing bin was stunned when she discovered footage showing a bin man chucking it into the back of his truck laura turned detective when she was told by her local council she must foot the bill for a new bin herself the number year old realised her bin was missing	https://www.thesun.co.uk/news/2968743/mum-three-36-missing-wheelie-bin-cctv-footage/	SunUK
152	1488219959	child minder paid pound number an hour hit or shook number month old baby to death after something inside her snapped	a child minder paid just pound number an hour killed a number month old baby boy when something snapped inside her a court was told nanny number is alleged to have hit or shaken joshua paul causing a traumatic head injury at his home in turnpike lane north london in number the youngster died in his	https://www.thesun.co.uk/news/2968458/hungarian-child-minder-killed-10-month-baby-london-trial/	SunUK
153	1488219032	mass brawl erupts on rugby pitch leaving one player with a broken jaw as his girlfriend slams disgusting twitter trolls	a mass brawl which broke out on a rugby league pitch left a number year old player with a broken jaw a snapped wisdom tooth and shards of teeth buried in his cheek engineering student has been left unable to speak eat or work for three months after the brutal out during a	https://www.thesun.co.uk/news/2968560/rugby-league-brawl-video-player-broken-jaw-challenge-cup/	SunUK
154	1488217485	tara palmer sister reads moving eulogy to tragic it girl at funeral attended by hundreds of mourners	tara palmer sister today read a moving eulogy to the tragic it girl at her funeral which was attended by hundreds of mourners santa spoke of her darling tara and addressing the socialite said i hope that you are resting because you found life hard and now it is done author santa posted her	https://www.thesun.co.uk/news/2968583/tara-palmer-tomkinson-funeral-sister-eulogy/	SunUK
155	1488216640	what is the super prison is open how many inmates can it hold and how much did it cost heres all you need to know	largest prison in wales with the goal of relieving overcrowded jails the enormous nick rehabilitate lags who will have rooms rather than cells so they do not reoffend what is the super prison and is it open hm prison is a category c jail in which is to	https://www.thesun.co.uk/news/2949296/wrexham-super-prison-hmp-berwyn/	SunUK
156	1488216067	john tribute act jailed for stabbing his parents in blood soaked attack sparked by violent row over them refusing to sell their home to help him raise cash	an john tribute act has been caged after he flew into a rage and stabbed both his parents in a violent row over them selling the family home mark ruck number stabbed his mum and dad after they sell their semi detached property so he could raise money to go on a paramedic course	https://www.thesun.co.uk/news/2968371/elton-john-tribute-act-stabbed-parents-mark-ruck-debt-row-jailed/	SunUK
157	1488215349	raging immigrant coming to uk for better life threatened to kill cabin crew and warned children will get hurt in drunken mid flight rampage	a latvian man on his way to start a new life in scotland threatened to kill cabin crew and said children would suffer a court heard flew from latvia to the uk earlier this month but was arrested after the plane touched down after landing at glasgow airport the number year old was taken in	https://www.thesun.co.uk/news/2968061/immigrant-coming-to-uk-threatened-cabin-crew-mid-flight-rampage-glasgow-arrest/	SunUK
158	1488214810	got talent star became friends with fan after youngster asked for autograph and then went round his house and was plied with booze	a got talent finalist plied a teenage fan with alcohol after befriending him when the number year old asked the star for an autograph a court heard bailey number was a member of dance troupe breakers who lost out to opera singer paul in the number final the youngster treatment for alcohol	https://www.thesun.co.uk/news/2964124/britains-got-talent-star-leeroy-bailey-trial-latest-kombat-breakers-2/	SunUK
159	1488214531	raging ex solider murdered wife by battering her with rolling pin and stabbing her number times as she pleaded for life to number phone operator	a former who murdered his filipino wife by stabbing her number times and battering her over the head with rolling pin has been jailed for life peter number launched the violent and brutal attack on his wife number after flying into a rage at their home on november number last year he	https://www.thesun.co.uk/news/2968073/ex-soldier-murdered-wife-rolling-pin-stabbed-999-call-peter-tripp-belen/	SunUK
160	1488214514	driver spotted flying down the number with a parrot perched on his steering wheel handed traffic offence report	a silly boy after spotting a driver flying down the number with a parrot perched on his steering wheel far from getting in a flap officers swiftly pulled over the driver in his number and issued a traffic offence report kent police february number	https://www.thesun.co.uk/news/2968053/driver-spotted-flying-down-the-m20-with-a-parrot-perched-on-his-steering-wheel-handed-traffic-offence-report/	SunUK
161	1488213640	student nurse heard her back crunch when she shattered spine jumping from number tower into foam pit at trampoline park	a student nurse claims her back exploded after she number into a foam pit at a trampoline park blamed for a string of spinal injuries jones said she fractured her leaping from the middle tower at flip out in chester the number year old claims she was left in agony and feared she could have	https://www.thesun.co.uk/news/2967889/student-nurse-heard-her-back-crunch-when-she-shattered-spine-jumping-from-12ft-tower-into-foam-pit-at-trampoline-park/	SunUK
162	1488211870	brit dad of three pushed to his death by spanish thugs armed with and parasols was trying to defend his teenage sons	a british holidaymaker who was pushed to his death by a baying spanish mob died trying to defend his two teenage sons an inquest heard today stephen number stepped in when a heavily armed gang of roughly number locals turned on his number year old twins peter and carl outside a bar the waiting	https://www.thesun.co.uk/news/2967414/brit-dad-of-three-pushed-to-his-death-by-spanish-thugs-armed-with-knuckledusters-and-parasols-was-trying-to-defend-his-teenage-sons/	SunUK
163	1488211348	wife who made millions in eye watering bonuses battles cheating ex husband after judge awarded him half of her fortune	a wife who made millions in eye watering bonuses as a city trader is battling her cheat ex husband after a divorce judge awarded him half of her fortune energy trader sharp and it consultant robin sharp both earned around pound number when they met but during their five year relationship she also received bonuses of pound number on the strength	https://www.thesun.co.uk/news/2967383/wife-millions-bonuses-battling-ex-husband-half-fortune/	SunUK
164	1488211280	prison officer to be charged with gross negligence manslaughter over inmate death	a prison officer is to be charged with gross negligence manslaughter over an inmates death joseph will be brought to court next month over the death of number year old harvey harvey was reportedly found hanging in his cell at in may number a crown prosecution service spokesman said following careful consideration of all	https://www.thesun.co.uk/news/2967673/hmp-woodhill-prisoner-death-manslaughter-gross-negligence/	SunUK
165	1488211002	bizarre moment drunken cat fight erupts on packed train as revellers anger fellow passenger by repeatedly placing a bagel on his head	boozed uptrain passengers were filmed fighting on an early morning service out of london after tempers flared due to a bagel being placed on peoples heads police boarded the rowdy train and held it at potters bar yesterday after three fights broke out in the same train carriage a stunned traveller managed to capture the bizarre	https://www.thesun.co.uk/news/2966914/bizarre-moment-rowdy-drunken-brawl-erupts-on-packed-train-after-cat-fighting-women-put-a-bagel-on-passengers-head/	SunUK
166	1488210593	moment pervert builder who groomed number year old girl for sex is caught by hunters the hunted one	this is the moment a pervert who thought he was meeting a number year old girl for sex was left a group of hunters turned up instead squirming danny watson tried to lie his way out of the encounter claiming he had only turned up outside a home he thought was the girls at number	https://www.thesun.co.uk/news/2966969/httpswww-thesun-co-uknews2636616the-hunted-one-vigilantes-paedophiles-catch/	SunUK
167	1488209498	passenger taken from to croydon via bristol after putting in wrong destination and falling asleep costing pound number	a man hoping to nip home to croydon from ended up travelling via bristol and was charged pound number after putting in the wrong destination in a journey which should take about number minutes and cost about pound number aaron wray was in an for five hours and number minutes after falling asleep his friend	https://www.thesun.co.uk/news/2964940/uber-passenger-taken-from-brixton-to-croydon-via-bristol-after-putting-in-wrong-destination-and-falling-asleep-costing-440/	SunUK
168	1488208101	who is karen best friend who led search for and why does she wants the case re opened	abduction is back in the spotlight screening of the and one of those at the heart of the case believes it should now be re opened was infamously jailed for eight years for her part the kidnap of her own daughter in number a story which shocked britain the	https://www.thesun.co.uk/news/2812218/julie-bushby-sheridan-smith-shannon-matthews-search-moorside-case-reopened/	SunUK
169	1488207887	who is lowery what is neuroblastoma and why are people sending christmas cards to the sunderland fans address	while football is known as a tribal and divisive sport one fan is bringing everyone connected to the game together lowery has won the hearts of players and fans after his on pitch appearances alongside his beloved sunderland and he stole the show at the sports personality of the year in december the five year old	https://www.thesun.co.uk/news/2404733/bradley-lowery-neuroblastoma-sunderland-football-fans/	SunUK
170	1488188400	lets not pretend host says muslim communities are not integrating in britain	host has insisted there is a huge problem when it comes to muslim communities integrating in britain	http://feedproxy.google.com/~r/daily-express-uk-news/~3/tSrMFnyH_Gw/Muslims-Britain-integrating-LBC-Maajid-Nawaz	DailyExpressUK
171	1488218460	trump cant silence me sadiq khan in dig at president during london oscars screening	the london mayor had a dig at donald trump at a screening of the salesman which was screened in the united kingdom after its iranian director boycotted the awards over the presidents immigration policy	http://feedproxy.google.com/~r/daily-express-uk-news/~3/HKIhsNdFJh4/Sadiq-Khan-Donald-Trump-Oscars-2017-The-Salesman-London-screening	DailyExpressUK
172	1488216060	couple lose battle to keep their terrier in no pets pound number million flat	a court ordered today that the dog must leave his owners pound number million penthouse flat to comply with a no pets rule	http://feedproxy.google.com/~r/daily-express-uk-news/~3/Lb6IroZOIs0/Couple-lose-battle-keep-terrier-no-pets-million-pound-flat	DailyExpressUK
173	1488215940	takeover hits a brick wall as london refuses to bow to ec anti trust probe	the london stock exchange has dramatically put the brakes on its merger with deutsche group amid an anti trust probe	http://feedproxy.google.com/~r/daily-express-uk-news/~3/Btlmk75l3fs/Brexit-LSE-Stock-market-European-Commission-anti-trust-Deutsche-Borse	DailyExpressUK
174	1488215580	matalan murders man researched how to kill his ex girlfriend and her new partner online	a man researched how to kill his ex girlfriend and her new partner online then stabbed them to death outside a shop	http://feedproxy.google.com/~r/daily-express-uk-news/~3/A4rC6QsI6UA/matalan-murders-man-researched-how-kill-his-ex-girlfriend-online	DailyExpressUK
175	1488216300	are comparable to isis this northern irish mp thinks so	a northern irish mp has said he agrees with loyalist murals which draw comparisons between the ira and isis	http://feedproxy.google.com/~r/daily-express-uk-news/~3/Tp1UKOHQWKw/Sammy-Wilson-compares-Sinn-Fein-ISIS-IRA-Northern-Ireland	DailyExpressUK
176	1488215700	many never recover former child migrant breaks down during sex abuse inquiry	a former child migrant broke down as he recalled the endemic problem of sexual abuse during an inquiry into a long running programme that saw thousands of british children sent to former colonies	http://feedproxy.google.com/~r/daily-express-uk-news/~3/cLPfnpJoA00/former-child-migrant-breaks-down-historical-sex-abuse-inquiry	DailyExpressUK
177	1488213900	female fagin made young children dress up in pyjamas and steal from a shop	a female fagin made young children dress up in pyjamas and steal from a shop a court was told	http://feedproxy.google.com/~r/daily-express-uk-news/~3/0mPdtTC743M/Female-Fagin-young-children-dress-pyjamas-steal-shop	DailyExpressUK
178	1488213180	russian shoplifter tried to steal bottle of wine worth almost pound number from	a russian shoplifter tried to swipe a bottle of wine worth almost pound number from a court heard	http://feedproxy.google.com/~r/daily-express-uk-news/~3/VM_HZOLhZ0w/russian-shoplifter-wine-theft-harrods-magistrates-court	DailyExpressUK
179	1488213900	adams backs brussels plans to punish britain for brexit vote	adams president of the political party claimed brussels should quite likely protect its interests by sanctioning britain over brexit	http://feedproxy.google.com/~r/daily-express-uk-news/~3/H7huAs6oLQc/Gerry-Adams-Sinn-Fein-backs-European-Union-Brexit-UK-penalties	DailyExpressUK
180	1488220700	troubled primary school closed after nine hundred angry parents sign petition demanding the headmistress be fired	brindle number was criticised after four governors resigned and up to number out of number teachers walked out on strike in a row centred on her leadership	http://www.mirror.co.uk/news/uk-news/troubled-primary-school-closed-after-9928453	MirrorUK
181	1488220222	huge rat filmed running rings around staff who stamp on it after it leaps into diners lap	warning distressing footage the rodent caused a commotion at a branch of the fast food chain in reading after leaping into a customers lap as she ate her foods	http://www.mirror.co.uk/news/uk-news/huge-rat-filmed-running-rings-9928805	MirrorUK
182	1488219574	under fire for opening stores on the high street disguised as independent book shops	the retail giants boss james daunt defended the move saying he wanted the chain to have bookshops with their own unique feel	http://www.mirror.co.uk/news/uk-news/waterstones-under-fire-opening-stores-9928822	MirrorUK
183	1488219522	man accused of killing doorman told aunt i think ive killed someone after stabbing victim in cigarette row	leighton holt allegedly stabbed daniel fox after one of the victims friends refused to share a cigarette a court heard	http://www.mirror.co.uk/news/uk-news/man-accused-killing-doorman-told-9927478	MirrorUK
